Level,Name,School,Casting Time,Range,Area,Components,Materials,Duration,Concentration,Ritual,Attack/Save,Damage/Effect,Source,Description,URL_absolute,Primary Effect Category,Arcane Status,Divine Status,Nature Status,Elemental Status,Psionics Status
1st,Arms of Hadar,Conjuration,1 Action,,(10 ft. ),"V, S",,Instantaneous,,,STR Save,Necrotic,,"Invoking Hadar, you cause tendrils to erupt from yourself. Each creature in a 10-foot Emanation originating from you makes a Strength saving throw. On a failed save, a target takes 2d6 Necrotic damage and can’t take Reactions until the start of its next turn. On a successful save, a target takes half as much damage only.

Using a Higher-Level Spell Slot. The damage increases by 1d6 for each spell slot level above 1.",https://www.dndbeyond.com/spells/2618871-arms-of-hadar,Force Manipulation,Primary,Hard Ban,Hard Ban,Secondary,Primary
1st,Catapult,Transmutation,1 Action,60 ft.,,S,,Instantaneous,,,DEX Save,Bludgeoning,,"Choose one object weighing 1 to 5 pounds within range that isn’t being worn or carried. The object flies in a straight line up to 90 feet in a direction you choose before falling to the ground, stopping early if it impacts against a solid surface. If the object would strike a creature, that creature must make a Dexterity saving throw. On a failed save, the object strikes the target and stops moving. When the object strikes something, the object and what it strikes each take 3d8 bludgeoning damage.

At Higher Levels. When you cast this spell using a spell slot of 2nd level or higher, the maximum weight of objects that you can target with this spell increases by 5 pounds, and the damage increases by 1d8, for each slot level above 1st.",https://www.dndbeyond.com/spells/2372-catapult,Transformation / Polymorph,Primary,Hard Ban,Secondary,Hard Ban,Hard Ban
1st,Color Spray,Illusion,1 Action,,(15 ft. ),"V, S, M",,Instantaneous,,,CON Save,Blinded,,"You launch a dazzling array of flashing, colorful light. Each creature in a 15-foot Cone originating from you must succeed on a Constitution saving throw or have the Blinded condition until the end of your next turn.",https://www.dndbeyond.com/spells/2618978-color-spray,Illusions & Glamours,Exclusive,Hard Ban,Hard Ban,Hard Ban,Hard Ban
1st,Detect Evil and Good,Divination,1 Action,,(30 ft. ),"V, S",,10 Minutes,,,,Detection,,"For the duration, you sense the location of any Aberration, Celestial, Elemental, Fey, Fiend, or Undead within 30 feet of yourself. You also sense whether the Hallow spell is active there and, if so, where.

The spell is blocked by 1 foot of stone, dirt, or wood; 1 inch of metal; or a thin sheet of lead.",https://www.dndbeyond.com/spells/2619090-detect-evil-and-good,Divination — Detection,Secondary,Hard Ban,Secondary,Hard Ban,Primary
1st,Detect Magic,Divination,1 Action,,(30 ft. ),"V, S",,10 Minutes,,,,Detection,,"For the duration, you sense the presence of magical effects within 30 feet of yourself. If you sense such effects, you can take the Magic action to see a faint aura around any visible creature or object in the area that bears the magic, and if an effect was created by a spell, you learn the spell’s school of magic.

The spell is blocked by 1 foot of stone, dirt, or wood; 1 inch of metal; or a thin sheet of lead.",https://www.dndbeyond.com/spells/2619097-detect-magic,Divination — Detection,Secondary,Hard Ban,Secondary,Hard Ban,Primary
1st,Detect Poison and Disease,Divination,1 Action,,(30 ft. ),"V, S, M",,10 Minutes,,,,Detection,,"For the duration, you sense the location of poisons, poisonous or venomous creatures, and magical contagions within 30 feet of yourself. You sense the kind of poison, creature, or contagion in each case.

The spell is blocked by 1 foot of stone, dirt, or wood; 1 inch of metal; or a thin sheet of lead.",https://www.dndbeyond.com/spells/2619093-detect-poison-and-disease,Divination — Detection,Secondary,Hard Ban,Secondary,Hard Ban,Primary
1st,Disguise Self,Illusion,1 Action,,,"V, S",,1 Hour,,,,Shapechanging,,"You make yourself—including your clothing, armor, weapons, and other belongings on your person—look different until the spell ends. You can seem 1 foot shorter or taller and can appear heavier or lighter. You must adopt a form that has the same basic arrangement of limbs as you have. Otherwise, the extent of the illusion is up to you.

The changes wrought by this spell fail to hold up to physical inspection. For example, if you use this spell to add a hat to your outfit, objects pass through the hat, and anyone who touches it would feel nothing.

To discern that you are disguised, a creature must take the Study action to inspect your appearance and succeed on an Intelligence ( Investigation ) check against your spell save DC.",https://www.dndbeyond.com/spells/2619102-disguise-self,Illusions & Glamours,Exclusive,Hard Ban,Hard Ban,Hard Ban,Hard Ban
1st,Distort Value,Illusion,1 Minute,,(1 ft. ),V,,8 Hours,,,,,,"Do you need to squeeze a few more gold pieces out of a merchant as you try to sell that weird octopus statue you liberated from the chaos temple? Do you need to downplay the worth of some magical assets when the tax collector stops by? Distort Value has you covered.

You cast this spell on an object no more than 1 foot on a side, doubling the object’s perceived value by adding illusory flourishes or polish to it, or reducing its perceived value by half with the help of illusory scratches, dents, and other unsightly features. Anyone examining the object can ascertain its true value with a successful Intelligence ( Investigation ) check against your spell save DC.

At Higher Levels. When you cast this spell using a spell slot of 2nd level or higher, the maximum size of the object increases by 1 foot for each slot level above 1st.",https://www.dndbeyond.com/spells/188092-distort-value,Illusions & Glamours,Exclusive,Hard Ban,Hard Ban,Hard Ban,Hard Ban
1st,Expeditious Retreat,Transmutation,1 Bonus Action,,,"V, S",,10 Minutes,,,,Movement,,"You take the Dash action, and until the spell ends, you can take that action again as a Bonus Action.",https://www.dndbeyond.com/spells/2619189-expeditious-retreat,Movement Enhancement,Primary,Hard Ban,Secondary,Hard Ban,Primary
1st,Faerie Fire,Evocation,1 Action,60 ft.,(20 ft. ),V,,1 Minute,,,DEX Save,Debuff,,"Objects in a 20-foot Cube within range are outlined in blue, green, or violet light (your choice). Each creature in the Cube is also outlined if it fails a Dexterity saving throw. For the duration, objects and affected creatures shed Dim Light in a 10-foot radius and can’t benefit from the Invisible condition.

Attack rolls against an affected creature or object have Advantage if the attacker can see it.",https://www.dndbeyond.com/spells/2618858-faerie-fire,Illusions & Glamours,Exclusive,Hard Ban,Hard Ban,Hard Ban,Hard Ban
1st,Feather Fall,Transmutation,1 Reaction *,60 ft.,,"V, M",,1 Minute,,,,Exploration (...),,"Choose up to five falling creatures within range. A falling creature’s rate of descent slows to 60 feet per round until the spell ends. If a creature lands before the spell ends, the creature takes no damage from the fall, and the spell ends for that creature.",https://www.dndbeyond.com/spells/2618874-feather-fall,Movement Enhancement,Primary,Hard Ban,Secondary,Hard Ban,Primary
1st,Identify,Divination,1 Minute,,,"V, S, M",,Instantaneous,,,,Detection,,"You touch an object throughout the spell’s casting. If the object is a magic item or some other magical object, you learn its properties and how to use them, whether it requires Attunement , and how many charges it has, if any. You learn whether any ongoing spells are affecting the item and what they are. If the item was created by a spell, you learn that spell’s name.

If you instead touch a creature throughout the casting, you learn which ongoing spells, if any, are currently affecting it.",https://www.dndbeyond.com/spells/2619180-identify,Divination — Detection,Secondary,Hard Ban,Secondary,Hard Ban,Primary
1st,Illusory Script,Illusion,1 Minute,,,"S, M",,10 Days,,,,Communication,,"You write on parchment, paper, or another suitable material and imbue it with an illusion that lasts for the duration. To you and any creatures you designate when you cast the spell, the writing appears normal, seems to be written in your hand, and conveys whatever meaning you intended when you wrote the text. To all others, the writing appears as if it were written in an unknown or magical script that is unintelligible. Alternatively, the illusion can alter the meaning, handwriting, and language of the text, though the language must be one you know.

If the spell is dispelled, the original script and the illusion both disappear.

A creature that has Truesight can read the hidden message.",https://www.dndbeyond.com/spells/2619173-illusory-script,Illusions & Glamours,Exclusive,Hard Ban,Hard Ban,Hard Ban,Hard Ban
1st,Jim's Magic Missile,Evocation,1 Action,120 ft.,,"V, S, M",,Instantaneous,,,Ranged,Force,,"Any apprentice wizard can cast a boring old magic missile . Sure, it always strikes its target. Yawn. Do away with the drudgery of your grandfather’s magic with this improved version of the spell, as used by Jim Darkmagic!

You create three twisting, whistling, hypoallergenic, gluten-free darts of magical force. Each dart targets a creature of your choice that you can see within range. Make a ranged spell attack for each missile. On a hit, a missile deals 2d4 force damage to its target.

If the attack roll scores a critical hit, the target of that missile takes 5d4 force damage instead of you rolling damage twice for a critical hit. If the attack roll for any missile is a 1, all missiles miss their targets and blow up in your face, dealing 1 force damage per missile to you.

At Higher Levels. When you cast this spell using a spell slot of 2nd level or higher, the spell creates one more dart, and the royalty component increases by 1 gp, for each slot level above 1st.",https://www.dndbeyond.com/spells/188129-jims-magic-missile,Force Manipulation,Primary,Hard Ban,Hard Ban,Secondary,Primary
1st,Jump,Transmutation,1 Bonus Action,,,"V, S, M",,1 Minute,,,,Movement,,"You touch a willing creature. Once on each of its turns until the spell ends, that creature can jump up to 30 feet by spending 10 feet of movement.

Using a Higher-Level Spell Slot. You can target one additional creature for each spell slot level above 1.",https://www.dndbeyond.com/spells/2618991-jump,Movement Enhancement,Primary,Hard Ban,Secondary,Hard Ban,Primary
1st,Longstrider,Transmutation,1 Action,,,"V, S, M",,1 Hour,,,,Buff (...),,"You touch a creature. The target’s Speed increases by 10 feet until the spell ends.

Using a Higher-Level Spell Slot. You can target one additional creature for each spell slot level above 1.",https://www.dndbeyond.com/spells/2619004-longstrider,Movement Enhancement,Primary,Hard Ban,Secondary,Hard Ban,Primary
1st,Magic Missile,Evocation,1 Action,120 ft.,,"V, S",,Instantaneous,,,,Force,,"You create three glowing darts of magical force. Each dart strikes a creature of your choice that you can see within range. A dart deals 1d4 + 1 Force damage to its target. The darts all strike simultaneously, and you can direct them to hit one creature or several.

Using a Higher-Level Spell Slot. The spell creates one more dart for each spell slot level above 1.",https://www.dndbeyond.com/spells/2619022-magic-missile,Force Manipulation,Primary,Hard Ban,Hard Ban,Secondary,Primary
1st,Shield,Abjuration,1 Reaction *,,,"V, S",,1 Round,,,,Warding,,"An imperceptible barrier of magical force protects you. Until the start of your next turn, you have a +5 bonus to AC, including against the triggering attack, and you take no damage from Magic Missile .",https://www.dndbeyond.com/spells/2619019-shield,Force Manipulation,Primary,Hard Ban,Hard Ban,Secondary,Primary
1st,Silent Image,Illusion,1 Action,60 ft.,(15 ft. *),"V, S, M",,10 Minutes,,,,Control,,"You create the image of an object, a creature, or some other visible phenomenon that is no larger than a 15-foot Cube . The image appears at a spot within range and lasts for the duration. The image is purely visual; it isn’t accompanied by sound, smell, or other sensory effects.

As a Magic action, you can cause the image to move to any spot within range. As the image changes location, you can alter its appearance so that its movements appear natural for the image. For example, if you create an image of a creature and move it, you can alter the image so that it appears to be walking.

Physical interaction with the image reveals it to be an illusion, since things can pass through it. A creature that takes a Study action to examine the image can determine that it is an illusion with a successful Intelligence ( Investigation ) check against your spell save DC. If a creature discerns the illusion for what it is, the creature can see through the image.",https://www.dndbeyond.com/spells/2619062-silent-image,Illusions & Glamours,Exclusive,Hard Ban,Hard Ban,Hard Ban,Hard Ban
1st,Snare,Abjuration,1 Minute,,,"S, M",,8 Hours,,,DEX Save,Restrained,,"As you cast this spell, you use the rope to create a circle with a 5-foot radius on the ground or the floor. When you finish casting, the rope disappears and the circle becomes a magic trap.

This trap is nearly invisible, requiring a successful Intelligence ( Investigation ) check against your spell save DC to be discerned.

The trap triggers when a Small, Medium, or Large creature moves onto the ground or the floor in the spell’s radius. That creature must succeed on a Dexterity saving throw or be magically hoisted into the air, leaving it hanging upside down 3 feet above the ground or the floor. The creature is restrained there until the spell ends.

A restrained creature can make a Dexterity saving throw at the end of each of its turns, ending the effect on itself on a success. Alternatively, the creature or someone else who can reach it can use an action to make an Intelligence ( Arcana ) check against your spell save DC. On a success, the restrained effect ends.

After the trap is triggered, the spell ends when no creature is restrained by it.",https://www.dndbeyond.com/spells/14600-snare,Illusions & Glamours,Exclusive,Hard Ban,Hard Ban,Hard Ban,Hard Ban
1st,Tenser's Floating Disk,Conjuration,1 Action,30 ft.,,"V, S, M",,1 Hour,,,,Movement (...),,"This spell creates a circular, horizontal plane of force, 3 feet in diameter and 1 inch thick, that floats 3 feet above the ground in an unoccupied space of your choice that you can see within range. The disk remains for the duration and can hold up to 500 pounds. If more weight is placed on it, the spell ends, and everything on the disk falls to the ground.

The disk is immobile while you are within 20 feet of it. If you move more than 20 feet away from it, the disk follows you so that it remains within 20 feet of you. It can move across uneven terrain, up or down stairs, slopes and the like, but it can’t cross an elevation change of 10 feet or more. For example, the disk can’t move across a 10-foot-deep pit, nor could it leave such a pit if it was created at the bottom.

If you move more than 100 feet from the disk (typically because it can’t move around an obstacle to follow you), the spell ends.",https://www.dndbeyond.com/spells/2619169-tensers-floating-disk,Force Manipulation,Primary,Hard Ban,Hard Ban,Secondary,Primary
1st,Unseen Servant,Conjuration,1 Action,60 ft.,,"V, S, M",,1 Hour,,,,Control,,"This spell creates an Invisible , mindless, shapeless, Medium force that performs simple tasks at your command until the spell ends. The servant springs into existence in an unoccupied space on the ground within range. It has AC 10, 1 Hit Point, and a Strength of 2, and it can’t attack. If it drops to 0 Hit Points, the spell ends.

Once on each of your turns as a Bonus Action, you can mentally command the servant to move up to 15 feet and interact with an object. The servant can perform simple tasks that a human could do, such as fetching things, cleaning, mending, folding clothes, lighting fires, serving food, and pouring drinks. Once you give the command, the servant performs the task to the best of its ability until it completes the task, then waits for your next command.

If you command the servant to perform a task that would move it more than 60 feet away from you, the spell ends.",https://www.dndbeyond.com/spells/2619209-unseen-servant,Force Manipulation,Primary,Hard Ban,Hard Ban,Secondary,Primary
1st,Zephyr Strike,Transmutation,1 Bonus Action,,,V,,1 Minute,,,,Force,,"You move like the wind. Until the spell ends, your movement doesn’t provoke opportunity attacks.

Once before the spell ends, you can give yourself advantage on one weapon attack roll on your turn. That attack deals an extra 1d8 force damage on a hit. Whether you hit or miss, your walking speed increases by 30 feet until the end of that turn.",https://www.dndbeyond.com/spells/14622-zephyr-strike,Movement Enhancement,Primary,Hard Ban,Secondary,Hard Ban,Primary
2nd,Alter Self,Transmutation,1 Action,,,"V, S",,1 Hour,,,,Shapechanging,,"You alter your physical form. Choose one of the following options. Its effects last for the duration, during which you can take a Magic action to replace the option you chose with a different one.

Aquatic Adaptation. You sprout gills and grow webs between your fingers. You can breathe underwater and gain a Swim Speed equal to your Speed.

Change Appearance. You alter your appearance. You decide what you look like, including your height, weight, facial features, sound of your voice, hair length, coloration, and other distinguishing characteristics. You can make yourself appear as a member of another species, though none of your statistics change. You can’t appear as a creature of a different size, and your basic shape stays the same; if you’re bipedal, you can’t use this spell to become quadrupedal, for instance. For the duration, you can take a Magic action to change your appearance in this way again.

Natural Weapons. You grow claws (Slashing), fangs (Piercing), horns (Piercing), or hooves (Bludgeoning). When you use your Unarmed Strike to deal damage with that new growth, it deals 1d6 damage of the type in parentheses instead of dealing the normal damage for your Unarmed Strike, and you use your spellcasting ability modifier for the attack and damage rolls rather than using Strength.",https://www.dndbeyond.com/spells/2618846-alter-self,Transformation / Polymorph,Primary,Hard Ban,Secondary,Hard Ban,Hard Ban
2nd,Animal Messenger,Enchantment,1 Action,30 ft.,,"V, S, M",,24 Hours,,,CHA Save,Communication (...),,"A Tiny Beast of your choice that you can see within range must succeed on a Charisma saving throw, or it attempts to deliver a message for you (if the target’s Challenge Rating isn’t 0, it automatically succeeds). You specify a location you have visited and a recipient who matches a general description, such as “a person dressed in the uniform of the town guard” or “a red-haired dwarf wearing a pointed hat.” You also communicate a message of up to twenty-five words. The Beast travels for the duration toward the specified location, covering about 25 miles per 24 hours or 50 miles if the Beast can fly.

When the Beast arrives, it delivers your message to the creature that you described, mimicking your communication. If the Beast doesn’t reach its destination before the spell ends, the message is lost, and the Beast returns to where you cast the spell.

Using a Higher-Level Spell Slot. The spell’s duration increases by 48 hours for each spell slot level above 2.",https://www.dndbeyond.com/spells/2618850-animal-messenger,Movement Enhancement,Primary,Hard Ban,Secondary,Hard Ban,Primary
2nd,Beast Sense,Divination,1 Action,,,S,,1 Hour,,,,Detection,,"You touch a willing Beast. For the duration, you can perceive through the Beast’s senses as well as your own. When perceiving through the Beast’s senses, you benefit from any special senses it has.",https://www.dndbeyond.com/spells/2618914-beast-sense,Divination — Detection,Secondary,Hard Ban,Secondary,Hard Ban,Primary
2nd,Blur,Illusion,1 Action,,,V,,1 Minute,,,,Warding,,"Your body becomes blurred. For the duration, any creature has Disadvantage on attack rolls against you. An attacker is immune to this effect if it perceives you with Blindsight or Truesight .",https://www.dndbeyond.com/spells/2618945-blur,Illusions & Glamours,Exclusive,Hard Ban,Hard Ban,Hard Ban,Hard Ban
2nd,Cloud of Daggers,Conjuration,1 Action,60 ft.,(5 ft. ),"V, S, M",,1 Minute,,,,Slashing,,"You conjure spinning daggers in a 5-foot Cube centered on a point within range. Each creature in that area takes 4d4 Slashing damage. A creature also takes this damage if it enters the Cube or ends its turn there or if the Cube moves into its space. A creature takes this damage only once per turn.

On your later turns, you can take a Magic action to teleport the Cube up to 30 feet.

Using a Higher-Level Spell Slot. The damage increases by 2d4 for each spell slot level above 2.",https://www.dndbeyond.com/spells/2618974-cloud-of-daggers,Teleportation & Spatial Bending,Primary,Hard Ban,Hard Ban,Hard Ban,Hard Ban
2nd,Continual Flame,Evocation,1 Action,,,"V, S, M",,Until Dispelled,,,,Creation,,"A flame springs from an object that you touch. The effect casts Bright Light in a 20-foot radius and Dim Light for an additional 20 feet. It looks like a regular flame, but it creates no heat and consumes no fuel. The flame can be covered or hidden but not smothered or quenched.",https://www.dndbeyond.com/spells/2619065-continual-flame,Illusions & Glamours,Exclusive,Hard Ban,Hard Ban,Hard Ban,Hard Ban
2nd,Darkvision,Transmutation,1 Action,,,"V, S, M",,8 Hours,,,,Buff,,"For the duration, a willing creature you touch has Darkvision with a range of 150 feet.",https://www.dndbeyond.com/spells/2619082-darkvision,Transformation / Polymorph,Primary,Hard Ban,Secondary,Hard Ban,Hard Ban
2nd,Detect Thoughts,Divination,1 Action,,,"V, S, M",,1 Minute,,,WIS Save,Detection (...),,"You activate one of the effects below. Until the spell ends, you can activate either effect as a Magic action on your later turns.

Sense Thoughts. You sense the presence of thoughts within 30 feet of yourself that belong to creatures that know languages or are telepathic. You don’t read the thoughts, but you know that a thinking creature is present.

The spell is blocked by 1 foot of stone, dirt, or wood; 1 inch of metal; or a thin sheet of lead.

Read Thoughts. Target one creature you can see within 30 feet of yourself or one creature within 30 feet of yourself that you detected with the Sense Thoughts option. You learn what is most on the target’s mind right now. If the target doesn’t know any languages and isn’t telepathic, you learn nothing.

As a Magic action on your next turn, you can try to probe deeper into the target’s mind. If you probe deeper, the target makes a Wisdom saving throw. On a failed save, you discern the target’s reasoning, emotions, and something that looms large in its mind (such as a worry, love, or hate). On a successful save, the spell ends. Either way, the target knows that you are probing into its mind, and until you shift your attention away from the target’s mind, the target can take an action on its turn to make an Intelligence ( Arcana ) check against your spell save DC, ending the spell on a success.",https://www.dndbeyond.com/spells/2619099-detect-thoughts,Divination — Detection,Secondary,Hard Ban,Secondary,Hard Ban,Primary
2nd,Earthbind,Transmutation,1 Action,300 ft.,,V,,1 Minute,,,STR Save,Control (...),,"Choose one creature you can see within range. Yellow strips of magical energy loop around the creature. The target must succeed on a Strength saving throw, or its flying speed (if any) is reduced to 0 feet for the spell’s duration. An airborne creature affected by this spell safely descends at 60 feet per round until it reaches the ground or the spell ends.",https://www.dndbeyond.com/spells/2377-earthbind,Transformation / Polymorph,Primary,Hard Ban,Secondary,Hard Ban,Hard Ban
2nd,Enhance Ability,Transmutation,1 Action,,,"V, S, M",,1 Hour,,,,Buff,,"You touch a creature and choose Strength, Dexterity, Intelligence, Wisdom, or Charisma. For the duration, the target has Advantage on ability checks using the chosen ability.

Using a Higher-Level Spell Slot. You can target one additional creature for each spell slot level above 2. You can choose a different ability for each target.",https://www.dndbeyond.com/spells/2619165-enhance-ability,Transformation / Polymorph,Primary,Hard Ban,Secondary,Hard Ban,Hard Ban
