Level,Name,School,Casting Time,Range,Area,Components,Materials,Duration,Concentration,Ritual,Attack/Save,Damage/Effect,Source,Description,URL_absolute,Primary Effect Category,Arcane Status,Divine Status,Nature Status,Elemental Status,Psionics Status
6th,Programmed Illusion,Illusion,1 Action,120 ft.,(30 ft. *),"V, S, M",,Until Dispelled,,,,Control,,"You create an illusion of an object, a creature, or some other visible phenomenon within range that activates when a specific trigger occurs. The illusion is imperceptible until then. It must be no larger than a 30-foot Cube , and you decide when you cast the spell how the illusion behaves and what sounds it makes. This scripted performance can last up to 5 minutes.

When the trigger you specify occurs, the illusion springs into existence and performs in the manner you described. Once the illusion finishes performing, it disappears and remains dormant for 10 minutes, after which the illusion can be activated again.

The trigger can be as general or as detailed as you like, though it must be based on visual or audible phenomena that occur within 30 feet of the area. For example, you could create an illusion of yourself to appear and warn off others who attempt to open a trapped door.

Physical interaction with the image reveals it to be illusory, since things can pass through it. A creature that takes the Study action to examine the image can determine that it is an illusion with a successful Intelligence ( Investigation ) check against your spell save DC. If a creature discerns the illusion for what it is, the creature can see through the image, and any noise it makes sounds hollow to the creature.",https://www.dndbeyond.com/spells/2618902-programmed-illusion,Illusions & Glamours,Exclusive,Hard Ban,Hard Ban,Hard Ban,Hard Ban
6th,Scatter,Conjuration,1 Action,30 ft.,,V,,Instantaneous,,,WIS Save,Control (...),,The air quivers around up to five creatures of your choice that you can see within range. An unwilling creature must succeed on a Wisdom saving throw to resist this spell. You teleport each affected target to an unoccupied space that you can see within 120 feet of you. That space must be on the ground or on a floor.,https://www.dndbeyond.com/spells/14593-scatter,Teleportation & Spatial Bending,Primary,Hard Ban,Hard Ban,Hard Ban,Hard Ban
6th,Tasha's Otherworldly Guise,Transmutation,1 Bonus Action,,,"V, S, M",,1 Minute,,,,Buff,,"Uttering an incantation, you draw on the magic of the Lower Planes or Upper Planes (your choice) to transform yourself. You gain the following benefits until the spell ends:

You are immune to fire and poison damage (Lower Planes) or radiant and necrotic damage (Upper Planes).

You are immune to the poisoned condition (Lower Planes) or the charmed condition (Upper Planes).

Spectral wings appear on your back, giving you a flying speed of 40 feet.

You have a +2 bonus to AC.

All your weapon attacks are magical, and when you make a weapon attack, you can use your spellcasting ability modifier, instead of Strength or Dexterity, for the attack and damage rolls.

You can attack twice, instead of once, when you take the Attack action on your turn. You ignore this benefit if you already have a feature, like Extra Attack, that lets you attack more than once when you take the Attack action on your turn.",https://www.dndbeyond.com/spells/719961-tashas-otherworldly-guise,Transformation / Polymorph,Primary,Hard Ban,Secondary,Hard Ban,Hard Ban
6th,Transport via Plants,Conjuration,1 Action,10 ft.,,"V, S",,1 Minute,,,,Teleportation,,"This spell creates a magical link between a Large or larger inanimate plant within range and another plant, at any distance, on the same plane of existence. You must have seen or touched the destination plant at least once before. For the duration, any creature can step into the target plant and exit from the destination plant by using 5 feet of movement.",https://www.dndbeyond.com/spells/2619196-transport-via-plants,Teleportation & Spatial Bending,Primary,Hard Ban,Hard Ban,Hard Ban,Hard Ban
6th,True Seeing,Divination,1 Action,,,"V, S, M",,1 Hour,,,,Detection,,"For the duration, the willing creature you touch has Truesight with a range of 120 feet.",https://www.dndbeyond.com/spells/2619201-true-seeing,Divination — Detection,Secondary,Hard Ban,Secondary,Hard Ban,Primary
6th,Wind Walk,Transmutation,1 Minute,30 ft.,,"V, S, M",,8 Hours,,,,Buff (...),,"You and up to ten willing creatures of your choice within range assume gaseous forms for the duration, appearing as wisps of cloud. While in this cloud form, a target has a Fly Speed of 300 feet and can hover; it has Immunity to the Prone condition; and it has Resistance to Bludgeoning, Piercing, and Slashing damage. The only actions a target can take in this form are the Dash action or a Magic action to begin reverting to its normal form. Reverting takes 1 minute, during which the target has the Stunned condition. Until the spell ends, the target can revert to cloud form, which also requires a Magic action followed by a 1-minute transformation.

If a target is in cloud form and flying when the effect ends, the target descends 60 feet per round for 1 minute until it lands, which it does safely. If it can’t land after 1 minute, it falls the remaining distance.",https://www.dndbeyond.com/spells/2619211-wind-walk,Movement Enhancement,Primary,Hard Ban,Secondary,Hard Ban,Primary
6th,Word of Recall,Conjuration,1 Action,5 ft.,,V,,Instantaneous,,,,Teleportation,,"You and up to five willing creatures within 5 feet of you instantly teleport to a previously designated sanctuary. You and any creatures that teleport with you appear in the nearest unoccupied space to the spot you designated when you prepared your sanctuary (see below). If you cast this spell without first preparing a sanctuary, the spell has no effect.

You must designate a location, such as a temple, as a sanctuary by casting this spell there.",https://www.dndbeyond.com/spells/2619218-word-of-recall,Teleportation & Spatial Bending,Primary,Hard Ban,Hard Ban,Hard Ban,Hard Ban
7th,Create Magen,Transmutation,1 Hour,,,"V, S, M",,Instantaneous,,,,,,,https://www.dndbeyond.com/spells/654073-create-magen,Transformation / Polymorph,Primary,Hard Ban,Secondary,Hard Ban,Hard Ban
7th,Draconic Transformation,Transmutation,1 Bonus Action,,(60 ft. ),"V, S, M",,1 Minute,,,DEX Save,Force,,,https://www.dndbeyond.com/spells/1183863-draconic-transformation,Transformation / Polymorph,Primary,Hard Ban,Secondary,Hard Ban,Hard Ban
7th,Dream of the Blue Veil,Conjuration,10 Minutes,20 ft.,,"V, S, M",,6 Hours,,,,Teleportation,,"You and up to eight willing creatures within range fall unconscious for the spell’s duration and experience visions of another world on the Material Plane, such as Oerth, Toril, Krynn, or Eberron. If the spell reaches its full duration, the visions conclude with each of you encountering and pulling back a mysterious blue curtain. The spell then ends with you mentally and physically transported to the world that was in the visions.

To cast this spell, you must have a magic item that originated on the world you wish to reach, and you must be aware of the world’s existence, even if you don’t know the world’s name. Your destination in the other world is a safe location within 1 mile of where the magic item was created. Alternatively, you can cast the spell if one of the affected creatures was born on the other world, which causes your destination to be a safe location within 1 mile of where that creature was born.

The spell ends early on a creature if that creature takes any damage, and the creature isn’t transported. If you take any damage, the spell ends for you and all the other creatures, with none of you being transported.",https://www.dndbeyond.com/spells/717915-dream-of-the-blue-veil,Teleportation & Spatial Bending,Primary,Hard Ban,Hard Ban,Hard Ban,Hard Ban
7th,Etherealness,Conjuration,1 Action,,,"V, S",,8 Hours,,,,Buff (...),,"You step into the border regions of the Ethereal Plane, where it overlaps with your current plane. You remain in the Border Ethereal for the duration. During this time, you can move in any direction. If you move up or down, every foot of movement costs an extra foot. You can perceive the plane you left, which looks gray, and you can’t see anything there more than 60 feet away.

While on the Ethereal Plane, you can affect and be affected only by creatures, objects, and effects on that plane. Creatures that aren’t on the Ethereal Plane can’t perceive or interact with you unless a feature gives them the ability to do so.

When the spell ends, you return to the plane you left in the spot that corresponds to your space in the Border Ethereal. If you appear in an occupied space, you are shunted to the nearest unoccupied space and take Force damage equal to twice the number of feet you are moved.

This spell ends instantly if you cast it while you are on the Ethereal Plane or a plane that doesn’t border it, such as one of the Outer Planes.

Using a Higher-Level Spell Slot. You can target up to three willing creatures (including yourself) for each spell slot level above 7. The creatures must be within 10 feet of you when you cast the spell.",https://www.dndbeyond.com/spells/2619193-etherealness,Force Manipulation,Primary,Hard Ban,Hard Ban,Secondary,Primary
7th,Forcecage,Evocation,1 Action,100 ft.,( *),"V, S, M",,1 Hour,,,CHA Save,Control (...),,"An immobile, Invisible , Cube -shaped prison composed of magical force springs into existence around an area you choose within range. The prison can be a cage or a solid box, as you choose.

A prison in the shape of a cage can be up to 20 feet on a side and is made from 1/2-inch diameter bars spaced 1/2 inch apart. A prison in the shape of a box can be up to 10 feet on a side, creating a solid barrier that prevents any matter from passing through it and blocking any spells cast into or out from the area.

When you cast the spell, any creature that is completely inside the cage’s area is trapped. Creatures only partially within the area, or those too large to fit inside it, are pushed away from the center of the area until they are completely outside it.

A creature inside the cage can’t leave it by nonmagical means. If the creature tries to use teleportation or interplanar travel to leave, it must first make a Charisma saving throw. On a successful save, the creature can use that magic to exit the cage. On a failed save, the creature doesn’t exit the cage and wastes the spell or effect. The cage also extends into the Ethereal Plane, blocking ethereal travel.

This spell can’t be dispelled by Dispel Magic .",https://www.dndbeyond.com/spells/2618916-forcecage,Teleportation & Spatial Bending,Primary,Hard Ban,Hard Ban,Hard Ban,Hard Ban
7th,Mirage Arcane,Illusion,10 Minutes,,(1 mile ),"V, S",,10 Days,,,,Control,,"You make terrain in an area up to 1 mile square look, sound, smell, and even feel like some other sort of terrain. Open fields or a road could be made to resemble a swamp, hill, crevasse, or some other rough or impassable terrain. A pond can be made to seem like a grassy meadow, a precipice like a gentle slope, or a rock-strewn gully like a wide and smooth road.

Similarly, you can alter the appearance of structures or add them where none are present. The spell doesn’t disguise, conceal, or add creatures.

The illusion includes audible, visual, tactile, and olfactory elements, so it can turn clear ground into Difficult Terrain (or vice versa) or otherwise impede movement through the area. Any piece of the illusory terrain (such as a rock or stick) that is removed from the spell’s area disappears immediately.

Creatures with Truesight can see through the illusion to the terrain’s true form; however, all other elements of the illusion remain, so while the creature is aware of the illusion’s presence, the creature can still physically interact with the illusion.",https://www.dndbeyond.com/spells/2619040-mirage-arcane,Illusions & Glamours,Exclusive,Hard Ban,Hard Ban,Hard Ban,Hard Ban
7th,Mordenkainen's Sword,Evocation,1 Action,90 ft.,,"V, S, M",,1 Minute,,,Melee,Force,,"You create a spectral sword that hovers within range. It lasts for the duration.

When the sword appears, you make a melee spell attack against a target within 5 feet of the sword. On a hit, the target takes Force damage equal to 4d12 plus your spellcasting ability modifier.

On your later turns, you can take a Bonus Action to move the sword up to 30 feet to a spot you can see and repeat the attack against the same target or a different one.",https://www.dndbeyond.com/spells/2619118-mordenkainens-sword,Force Manipulation,Primary,Hard Ban,Hard Ban,Secondary,Primary
7th,Plane Shift,Conjuration,1 Action,,,"V, S, M",,Instantaneous,,,,Banishment (...),,"You and up to eight willing creatures who link hands in a circle are transported to a different plane of existence. You can specify a target destination in general terms, such as the City of Brass on the Elemental Plane of Fire or the palace of Dispater on the second level of the Nine Hells, and you appear in or near that destination, as determined by the DM.

Alternatively, if you know the sigil sequence of a teleportation circle on another plane of existence, this spell can take you to that circle. If the teleportation circle is too small to hold all the creatures you transported, they appear in the closest unoccupied spaces next to the circle.",https://www.dndbeyond.com/spells/2618867-plane-shift,Teleportation & Spatial Bending,Primary,Hard Ban,Hard Ban,Hard Ban,Hard Ban
7th,Project Image,Illusion,1 Action,500 miles,,"V, S, M",,1 Day,,,,Control,,"You create an illusory copy of yourself that lasts for the duration. The copy can appear at any location within range that you have seen before, regardless of intervening obstacles. The illusion looks and sounds like you, but it is intangible. If the illusion takes any damage, it disappears, and the spell ends.

You can see through the illusion’s eyes and hear through its ears as if you were in its space. As a Magic action, you can move it up to 60 feet and make it gesture, speak, and behave in whatever way you choose. It mimics your mannerisms perfectly.

Physical interaction with the image reveals it to be illusory, since things can pass through it. A creature that takes the Study action to examine the image can determine that it is an illusion with a successful Intelligence ( Investigation ) check against your spell save DC. If a creature discerns the illusion for what it is, the creature can see through the image, and any noise it makes sounds hollow to the creature.",https://www.dndbeyond.com/spells/2618903-project-image,Illusions & Glamours,Exclusive,Hard Ban,Hard Ban,Hard Ban,Hard Ban
7th,Regenerate,Transmutation,1 Minute,,,"V, S, M",,1 Hour,,,,Healing,,"A creature you touch regains 4d8 + 15 Hit Points. For the duration, the target regains 1 Hit Point at the start of each of its turns, and any severed body parts regrow after 2 minutes.",https://www.dndbeyond.com/spells/2618937-regenerate,Transformation / Polymorph,Primary,Hard Ban,Secondary,Hard Ban,Hard Ban
7th,Reverse Gravity,Transmutation,1 Action,100 ft.,(50 ft. *),"V, S, M",,1 Minute,,,DEX Save,Control,,"This spell reverses gravity in a 50-foot-radius, 100-foot high Cylinder centered on a point within range. All creatures and objects in that area that aren’t anchored to the ground fall upward and reach the top of the Cylinder. A creature can make a Dexterity saving throw to grab a fixed object it can reach, thus avoiding the fall upward.

If a ceiling or an anchored object is encountered in this upward fall, creatures and objects strike it just as they would during a downward fall. If an affected creature or object reaches the Cylinder’s top without striking anything, it hovers there for the duration. When the spell ends, affected objects and creatures fall downward.",https://www.dndbeyond.com/spells/2618954-reverse-gravity,Transformation / Polymorph,Primary,Hard Ban,Secondary,Hard Ban,Hard Ban
7th,Simulacrum,Illusion,12 Hours,,,"V, S, M",,Until Dispelled,,,,Deception (...),,"You create a simulacrum of one Beast or Humanoid that is within 10 feet of you for the entire casting of the spell. You finish the casting by touching both the creature and a pile of ice or snow that is the same size as that creature, and the pile turns into the simulacrum, which is a creature. It uses the game statistics of the original creature at the time of casting, except it is a Construct, its Hit Point maximum is half as much, and it can’t cast this spell.

The simulacrum is Friendly to you and creatures you designate. It obeys your commands and acts on your turn in combat. The simulacrum can’t gain levels, and it can’t take Short or Long Rests.

If the simulacrum takes damage, the only way to restore its Hit Points is to repair it as you take a Long Rest, during which you expend components worth 100 GP per Hit Point restored. The simulacrum must stay within 5 feet of you for the repair.

The simulacrum lasts until it drops to 0 Hit Points, at which point it reverts to snow and melts away. If you cast this spell again, any simulacrum you created with this spell is instantly destroyed.",https://www.dndbeyond.com/spells/2618995-simulacrum,Constructs / Artifice,Exclusive,Hard Ban,Hard Ban,Hard Ban,Hard Ban
7th,Teleport,Conjuration,1 Action,10 ft.,,V,,Instantaneous,,,,Teleportation,,"This spell instantly transports you and up to eight willing creatures that you can see within range, or a single object that you can see within range, to a destination you select. If you target an object, it must be Large or smaller, and it can’t be held or carried by an unwilling creature.

The destination you choose must be known to you, and it must be on the same plane of existence as you. Your familiarity with the destination determines whether you arrive there successfully. The DM rolls 1d100 and consults the Teleportation Outcome table and the explanations after it.

Familiarity. Here are the meanings of the terms in the table’s Familiarity column:

“Permanent circle” means a permanent teleportation circle whose sigil sequence you know.

“Linked object” means you possess an object taken from the desired destination within the last six months, such as a book from a wizard’s library.

“Very familiar” is a place you have visited often, a place you have carefully studied, or a place you can see when you cast the spell.

“Seen casually” is a place you have seen more than once but with which you aren’t very familiar.

“Viewed once or described” is a place you have seen once, possibly using magic, or a place you know through someone else’s description, perhaps from a map.

“False destination” is a place that doesn’t exist. Perhaps you tried to scry an enemy’s sanctum but instead viewed an illusion, or you are attempting to teleport to a location that no longer exists.

Mishap. The spell’s unpredictable magic results in a difficult journey. Each teleporting creature (or the target object) takes 3d10 Force damage, and the DM rerolls on the table to see where you wind up (multiple mishaps can occur, dealing damage each time).

Similar Area. You and your group (or the target object) appear in a different area that’s visually or thematically similar to the target area. You appear in the closest similar place. If you are heading for your home laboratory, for example, you might appear in another person’s laboratory in the same city.

Off Target. You and your group (or the target object) appear 2d12 miles away from the destination in a random direction. Roll 1d8 for the direction: 1 , east; 2 , southeast; 3 , south; 4 , southwest; 5 , west; 6 , northwest; 7 , north; or 8 , northeast.

On Target. You and your group (or the target object) appear where you intended.",https://www.dndbeyond.com/spells/2619163-teleport,Teleportation & Spatial Bending,Primary,Hard Ban,Hard Ban,Hard Ban,Hard Ban
8th,Abi-Dalzim's Horrid Wilting,Necromancy,1 Action,150 ft.,(30 ft. ),"V, S, M",,Instantaneous,,,CON Save,Necrotic,,"You draw the moisture from every creature in a 30-foot cube centered on a point you choose within range. Each creature in that area must make a Constitution saving throw. Constructs and undead aren’t affected, and plants and water elementals make this saving throw with disadvantage. A creature takes 12d8 necrotic damage on a failed save, or half as much damage on a successful one.

Nonmagical plants in the area that aren’t creatures, such as trees and shrubs, wither and die instantly.",https://www.dndbeyond.com/spells/2367-abi-dalzims-horrid-wilting,Constructs / Artifice,Exclusive,Hard Ban,Hard Ban,Hard Ban,Hard Ban
8th,Animal Shapes,Transmutation,1 Action,30 ft.,,"V, S",,24 Hours,,,,Shapechanging,,"Choose any number of willing creatures that you can see within range. Each target shape-shifts into a Large or smaller Beast of your choice that has a Challenge Rating of 4 or lower. You can choose a different form for each target. On later turns, you can take a Magic action to transform the targets again.

A target’s game statistics are replaced by the chosen Beast’s statistics, but the target retains its creature type; Hit Points; Hit Point Dice; alignment; ability to communicate; and Intelligence, Wisdom, and Charisma scores. The target’s actions are limited by the Beast form’s anatomy, and it can’t cast spells. The target’s equipment melds into the new form, and the target can’t use any of that equipment while in that form.

The target gains a number of Temporary Hit Points equal to the Hit Points of the first form into which it shape-shifts. These Temporary Hit Points vanish if any remain when the spell ends. The transformation lasts for the duration or until the target ends it as a Bonus Action.",https://www.dndbeyond.com/spells/2618851-animal-shapes,Transformation / Polymorph,Primary,Hard Ban,Secondary,Hard Ban,Hard Ban
8th,Antimagic Field,Abjuration,1 Action,,(10 ft. ),"V, S, M",,1 Hour,,,,Control (...),,"An aura of antimagic surrounds you in 10-foot Emanation . No one can cast spells, take Magic actions, or create other magical effects inside the aura, and those things can’t target or otherwise affect anything inside it. Magical properties of magic items don’t work inside the aura or on anything inside it.

Areas of effect created by spells or other magic can’t extend into the aura, and no one can teleport into or out of it or use planar travel there. Portals close temporarily while in the aura.

Ongoing spells, except those cast by an Artifact or a deity, are suppressed in the area. While an effect is suppressed, it doesn’t function, but the time it spends suppressed counts against its duration.

Dispel Magic has no effect on the aura, and the auras created by different Antimagic Field spells don’t nullify each other.",https://www.dndbeyond.com/spells/2618860-antimagic-field,Teleportation & Spatial Bending,Primary,Hard Ban,Hard Ban,Hard Ban,Hard Ban
8th,Demiplane,Conjuration,1 Action,60 ft.,,S,,1 Hour,,,,Utility,,"You create a shadowy Medium door on a flat solid surface that you can see within range. This door can be opened and closed, and it leads to a demiplane that is an empty room 30 feet in each dimension, made of wood or stone (your choice).

When the spell ends, the door vanishes, and any objects inside the demiplane remain there. Any creatures inside also remain unless they opt to be shunted through the door as it vanishes, landing with the Prone condition in the unoccupied spaces closest to the door’s former space.

Each time you cast this spell, you can create a new demiplane or connect the shadowy door to a demiplane you created with a previous casting of this spell. Additionally, if you know the nature and contents of a demiplane created by a casting of this spell by another creature, you can connect the shadowy door to that demiplane instead.",https://www.dndbeyond.com/spells/2619088-demiplane,Teleportation & Spatial Bending,Primary,Hard Ban,Hard Ban,Hard Ban,Hard Ban
8th,Maze,Conjuration,1 Action,60 ft.,,"V, S",,10 Minutes,,,,Banishment (...),,"You banish a creature that you can see within range into a labyrinthine demiplane. The target remains there for the duration or until it escapes the maze.

The target can take a Study action to try to escape. When it does so, it makes a DC 20 Intelligence ( Investigation ) check. If it succeeds, it escapes, and the spell ends.

When the spell ends, the target reappears in the space it left or, if that space is occupied, in the nearest unoccupied space.",https://www.dndbeyond.com/spells/2619030-maze,Teleportation & Spatial Bending,Primary,Hard Ban,Hard Ban,Hard Ban,Hard Ban
