Level,Name,School,Casting Time,Range,Area,Components,Materials,Duration,Concentration,Ritual,Attack/Save,Damage/Effect,Source,Description,URL_absolute,Primary Effect Category,Arcane Status,Divine Status,Nature Status,Elemental Status,Psionics Status
2nd,Enlarge/Reduce,Transmutation,1 Action,30 ft.,,"V, S, M",,1 Minute,,,CON Save,Buff,,"For the duration, the spell enlarges or reduces a creature or an object you can see within range (see the chosen effect below). A targeted object must be neither worn nor carried. If the target is an unwilling creature, it can make a Constitution saving throw. On a successful save, the spell has no effect.

Everything that a targeted creature is wearing and carrying changes size with it. Any item it drops returns to normal size at once. A thrown weapon or piece of ammunition returns to normal size immediately after it hits or misses a target.

Enlarge. The target’s size increases by one category—from Medium to Large, for example. The target also has Advantage on Strength checks and Strength saving throws. The target’s attacks with its enlarged weapons or Unarmed Strikes deal an extra 1d4 damage on a hit.

Reduce. The target’s size decreases by one category—from Medium to Small, for example. The target also has Disadvantage on Strength checks and Strength saving throws. The target’s attacks with its reduced weapons or Unarmed Strikes deal 1d4 less damage on a hit (this can’t reduce the damage below 1).",https://www.dndbeyond.com/spells/2619170-enlarge-reduce,Transformation / Polymorph,Primary,Hard Ban,Secondary,Hard Ban,Hard Ban
2nd,Find Traps,Divination,1 Action,120 ft.,,"V, S",,Instantaneous,,,,Detection,,"You sense any trap within range that is within line of sight. A trap, for the purpose of this spell, includes any object or mechanism that was created to cause damage or other danger. Thus, the spell would sense the Alarm or Glyph of Warding spell or a mechanical pit trap, but it wouldn’t reveal a natural weakness in the floor, an unstable ceiling, or a hidden sinkhole.

This spell reveals that a trap is present but not its location. You do learn the general nature of the danger posed by a trap you sense.",https://www.dndbeyond.com/spells/2618883-find-traps,Divination — Detection,Secondary,Hard Ban,Secondary,Hard Ban,Primary
2nd,Invisibility,Illusion,1 Action,,,"V, S, M",,1 Hour,,,,Invisible,,"A creature you touch has the Invisible condition until the spell ends. The spell ends early immediately after the target makes an attack roll, deals damage, or casts a spell.

Using a Higher-Level Spell Slot. You can target one additional creature for each spell slot level above 2.",https://www.dndbeyond.com/spells/2619116-invisibility,Illusions & Glamours,Exclusive,Hard Ban,Hard Ban,Hard Ban,Hard Ban
2nd,Kinetic Jaunt,Transmutation,1 Bonus Action,,,S,,1 Minute,,,,Buff,,,https://www.dndbeyond.com/spells/1239803-kinetic-jaunt,Transformation / Polymorph,Primary,Hard Ban,Secondary,Hard Ban,Hard Ban
2nd,Levitate,Transmutation,1 Action,60 ft.,,"V, S, M",,10 Minutes,,,CON Save,Movement,,"One creature or loose object of your choice that you can see within range rises vertically up to 20 feet and remains suspended there for the duration. The spell can levitate an object that weighs up to 500 pounds. An unwilling creature that succeeds on a Constitution saving throw is unaffected.

The target can move only by pushing or pulling against a fixed object or surface within reach (such as a wall or a ceiling), which allows it to move as if it were climbing. You can change the target’s altitude by up to 20 feet in either direction on your turn. If you are the target, you can move up or down as part of your move. Otherwise, you can take a Magic action to move the target, which must remain within the spell’s range.

When the spell ends, the target floats gently to the ground if it is still aloft.",https://www.dndbeyond.com/spells/2618994-levitate,Transformation / Polymorph,Primary,Hard Ban,Secondary,Hard Ban,Hard Ban
2nd,Locate Object,Divination,1 Action,,,"V, S, M",,10 Minutes,,,,Detection,,"Describe or name an object that is familiar to you. You sense the direction to the object’s location if that object is within 1,000 feet of you. If the object is in motion, you know the direction of its movement.

The spell can locate a specific object known to you if you have seen it up close—within 30 feet—at least once. Alternatively, the spell can locate the nearest object of a particular kind, such as a certain kind of apparel, jewelry, furniture, tool, or weapon.

This spell can’t locate an object if any thickness of lead blocks a direct path between you and the object.",https://www.dndbeyond.com/spells/2619002-locate-object,Divination — Detection,Secondary,Hard Ban,Secondary,Hard Ban,Primary
2nd,Magic Mouth,Illusion,1 Minute,30 ft.,,"V, S, M",,Until Dispelled,,,,Communication,,"You implant a message within an object in range—a message that is uttered when a trigger condition is met. Choose an object that you can see and that isn’t being worn or carried by another creature. Then speak the message, which must be 25 words or fewer, though it can be delivered over as long as 10 minutes. Finally, determine the circumstance that will trigger the spell to deliver your message.

When that trigger occurs, a magical mouth appears on the object and recites the message in your voice and at the same volume you spoke. If the object you chose has a mouth or something that looks like a mouth (for example, the mouth of a statue), the magical mouth appears there, so the words appear to come from the object’s mouth. When you cast this spell, you can have the spell end after it delivers its message, or it can remain and repeat its message whenever the trigger occurs.

The trigger can be as general or as detailed as you like, though it must be based on visual or audible conditions that occur within 30 feet of the object. For example, you could instruct the mouth to speak when any creature moves within 30 feet of the object or when a silver bell rings within 30 feet of it.",https://www.dndbeyond.com/spells/2619023-magic-mouth,Illusions & Glamours,Exclusive,Hard Ban,Hard Ban,Hard Ban,Hard Ban
2nd,Magic Weapon,Transmutation,1 Bonus Action,,,"V, S",,1 Hour,,,,Buff,,"You touch a nonmagical weapon. Until the spell ends, that weapon becomes a magic weapon with a +1 bonus to attack rolls and damage rolls. The spell ends early if you cast it again.

Using a Higher-Level Spell Slot. The bonus increases to +2 with a level 3–5 spell slot. The bonus increases to +3 with a level 6+ spell slot.",https://www.dndbeyond.com/spells/2619024-magic-weapon,Transformation / Polymorph,Primary,Hard Ban,Secondary,Hard Ban,Hard Ban
2nd,Mind Spike,Divination,1 Action,120 ft.,,S,,1 Hour,,,WIS Save,Psychic,,"You drive a spike of psionic energy into the mind of one creature you can see within range. The target makes a Wisdom saving throw, taking 3d8 Psychic damage on a failed save or half as much damage on a successful one. On a failed save, you also always know the target’s location until the spell ends, but only while the two of you are on the same plane of existence. While you have this knowledge, the target can’t become hidden from you, and if it has the Invisible condition, it gains no benefit from that condition against you.

Using a Higher-Level Spell Slot. The damage increases by 1d8 for each spell slot level above 2.",https://www.dndbeyond.com/spells/2619038-mind-spike,Illusions & Glamours,Exclusive,Hard Ban,Hard Ban,Hard Ban,Hard Ban
2nd,Mirror Image,Illusion,1 Action,,,"V, S",,1 Minute,,,,Deception (...),,"Three illusory duplicates of yourself appear in your space. Until the spell ends, the duplicates move with you and mimic your actions, shifting position so it’s impossible to track which image is real.

Each time a creature hits you with an attack roll during the spell’s duration, roll a d6 for each of your remaining duplicates. If any of the d6s rolls a 3 or higher, one of the duplicates is hit instead of you, and the duplicate is destroyed. The duplicates otherwise ignore all other damage and effects. The spell ends when all three duplicates are destroyed.

A creature is unaffected by this spell if it has the Blinded condition, Blindsight , or Truesight .",https://www.dndbeyond.com/spells/2619060-mirror-image,Illusions & Glamours,Exclusive,Hard Ban,Hard Ban,Hard Ban,Hard Ban
2nd,Misty Step,Conjuration,1 Bonus Action,,,V,,Instantaneous,,,,Teleportation,,"Briefly surrounded by silvery mist, you teleport up to 30 feet to an unoccupied space you can see.",https://www.dndbeyond.com/spells/2619133-misty-step,Teleportation & Spatial Bending,Primary,Hard Ban,Hard Ban,Hard Ban,Hard Ban
2nd,Moonbeam,Evocation,1 Action,120 ft.,(5 ft. *),"V, S, M",,1 Minute,,,CON Save,Radiant,,"A silvery beam of pale light shines down in a 5-foot-radius, 40-foot-high Cylinder centered on a point within range. Until the spell ends, Dim Light fills the Cylinder, and you can take a Magic action on later turns to move the Cylinder up to 60 feet.

When the Cylinder appears, each creature in it makes a Constitution saving throw. On a failed save, a creature takes 2d10 Radiant damage, and if the creature is shape-shifted (as a result of the Polymorph spell, for example), it reverts to its true form and can’t shape-shift until it leaves the Cylinder. On a successful save, a creature takes half as much damage only. A creature also makes this save when the spell’s area moves into its space and when it enters the spell’s area or ends its turn there. A creature makes this save only once per turn.

Using a Higher-Level Spell Slot. The damage increases by 1d10 for each spell slot level above 2.",https://www.dndbeyond.com/spells/2619134-moonbeam,Transformation / Polymorph,Primary,Hard Ban,Secondary,Hard Ban,Hard Ban
2nd,Nathair's Mischief,Illusion,1 Action,60 ft.,(20 ft. ),"S, M",,1 Minute,,,,Charmed (...),,,https://www.dndbeyond.com/spells/1183865-nathairs-mischief,Illusions & Glamours,Exclusive,Hard Ban,Hard Ban,Hard Ban,Hard Ban
2nd,Nystul's Magic Aura,Illusion,1 Action,,,"V, S, M",,24 Hours,,,,Deception,,"With a touch, you place an illusion on a willing creature or an object that isn’t being worn or carried. A creature gains the Mask effect below, and an object gains the False Aura effect below. The effect lasts for the duration. If you cast the spell on the same target every day for 30 days, the illusion lasts until dispelled.

Mask (Creature). Choose a creature type other than the target’s actual type. Spells and other magical effects treat the target as if it were a creature of the chosen type.

False Aura (Object). You change the way the target appears to spells and magical effects that detect magical auras, such as Detect Magic . You can make a nonmagical object appear magical, make a magic item appear nonmagical, or change the object’s aura so that it appears to belong to a school of magic you choose.",https://www.dndbeyond.com/spells/2619124-nystuls-magic-aura,Illusions & Glamours,Exclusive,Hard Ban,Hard Ban,Hard Ban,Hard Ban
2nd,Phantasmal Force,Illusion,1 Action,60 ft.,(10 ft. *),"V, S, M",,1 Minute,,,INT Save,Psychic,,"You attempt to craft an illusion in the mind of a creature you can see within range. The target makes an Intelligence saving throw. On a failed save, you create a phantasmal object, creature, or other phenomenon that is no larger than a 10-foot Cube and that is perceivable only to the target for the duration. The phantasm includes sound, temperature, and other stimuli.

The target can take a Study action to examine the phantasm with an Intelligence ( Investigation ) check against your spell save DC. If the check succeeds, the target realizes that the phantasm is an illusion, and the spell ends.

While affected by the spell, the target treats the phantasm as if it were real and rationalizes any illogical outcomes from interacting with it. For example, if the target steps through a phantasmal bridge and survives the fall, it believes the bridge exists and something else caused it to fall.

An affected target can even take damage from the illusion if the phantasm represents a dangerous creature or hazard. On each of your turns, such a phantasm can deal 2d8 Psychic damage to the target if it is in the phantasm’s area or within 5 feet of the phantasm. The target perceives the damage as a type appropriate to the illusion.",https://www.dndbeyond.com/spells/2618854-phantasmal-force,Illusions & Glamours,Exclusive,Hard Ban,Hard Ban,Hard Ban,Hard Ban
2nd,Rope Trick,Transmutation,1 Action,,,"V, S, M",,1 Hour,,,,Utility,,"You touch a rope. One end of it hovers upward until the rope hangs perpendicular to the ground or the rope reaches a ceiling. At the rope’s upper end, an Invisible 3-foot-by-5-foot portal opens to an extradimensional space that lasts until the spell ends. That space can be reached by climbing the rope, which can be pulled into or dropped out of it.

The space can hold up to eight Medium or smaller creatures. Attacks, spells, and other effects can’t pass into or out of the space, but creatures inside it can see through the portal. Anything inside the space drops out when the spell ends.",https://www.dndbeyond.com/spells/2618962-rope-trick,Teleportation & Spatial Bending,Primary,Hard Ban,Hard Ban,Hard Ban,Hard Ban
2nd,See Invisibility,Divination,1 Action,,,"V, S, M",,1 Hour,,,,Detection,,"For the duration, you see creatures and objects that have the Invisible condition as if they were visible, and you can see into the Ethereal Plane. Creatures and objects there appear ghostly.",https://www.dndbeyond.com/spells/2619011-see-invisibility,Illusions & Glamours,Exclusive,Hard Ban,Hard Ban,Hard Ban,Hard Ban
2nd,Shadow Blade,Illusion,1 Bonus Action,,,"V, S",,1 Minute,,,,Psychic,,"You weave together threads of shadow to create a sword of solidified gloom in your hand. This magic sword lasts until the spell ends. It counts as a simple melee weapon with which you are proficient. It deals 2d8 psychic damage on a hit and has the finesse , light , and thrown properties (range 20/60). In addition, when you use the sword to attack a target that is in dim light or darkness, you make the attack roll with advantage.

If you drop the weapon or throw it, it dissipates at the end of the turn. Thereafter, while the spell persists, you can use a bonus action to cause the sword to reappear in your hand.

At Higher Levels. When you cast this spell using a 3rd- or 4th-level spell slot, the damage increases to 3d8. When you cast it using a 5th- or 6th-level spell slot, the damage increases to 4d8. When you cast it using a spell slot of 7th level or higher, the damage increases to 5d8.",https://www.dndbeyond.com/spells/14595-shadow-blade,Force Manipulation,Primary,Hard Ban,Hard Ban,Secondary,Primary
2nd,Shatter,Evocation,1 Action,60 ft.,(10 ft. ),"V, S, M",,Instantaneous,,,CON Save,Thunder,,"A loud noise erupts from a point of your choice within range. Each creature in a 10-foot-radius Sphere centered there makes a Constitution saving throw, taking 3d8 Thunder damage on a failed save or half as much damage on a successful one. A Construct has Disadvantage on the save.

A nonmagical object that isn’t being worn or carried also takes the damage if it’s in the spell’s area.

Using a Higher-Level Spell Slot. The damage increases by 1d8 for each spell slot level above 2.",https://www.dndbeyond.com/spells/2619017-shatter,Constructs / Artifice,Exclusive,Hard Ban,Hard Ban,Hard Ban,Hard Ban
2nd,Shining Smite,Transmutation,1 Bonus Action *,,,V,,1 Minute,,,,Radiant,,"The target hit by the strike takes an extra 2d6 Radiant damage from the attack. Until the spell ends, the target sheds Bright Light in a 5-foot radius, attack rolls against it have Advantage, and it can’t benefit from the Invisible condition.

Using a Higher-Level Spell Slot. The damage increases by 1d6 for each spell slot level above 2.",https://www.dndbeyond.com/spells/2618838-shining-smite,Illusions & Glamours,Exclusive,Hard Ban,Hard Ban,Hard Ban,Hard Ban
2nd,Silence,Illusion,1 Action,120 ft.,(20 ft. ),"V, S",,10 Minutes,,,,Control,,"For the duration, no sound can be created within or pass through a 20-foot-radius Sphere centered on a point you choose within range. Any creature or object entirely inside the Sphere has Immunity to Thunder damage, and creatures have the Deafened condition while entirely inside it. Casting a spell that includes a Verbal component is impossible there.",https://www.dndbeyond.com/spells/2619061-silence,Illusions & Glamours,Exclusive,Hard Ban,Hard Ban,Hard Ban,Hard Ban
2nd,Skywrite,Transmutation,1 Action,,,"V, S",,1 Hour,,,,Communication (...),,You cause up to ten words to form in a part of the sky you can see. The words appear to be made of cloud and remain in place for the spell’s duration. The words dissipate when the spell ends. A strong wind can disperse the clouds and end the spell early.,https://www.dndbeyond.com/spells/2398-skywrite,Transformation / Polymorph,Primary,Hard Ban,Secondary,Hard Ban,Hard Ban
2nd,Spider Climb,Transmutation,1 Action,,,"V, S, M",,1 Hour,,,,Buff (...),,"Until the spell ends, one willing creature you touch gains the ability to move up, down, and across vertical surfaces and along ceilings, while leaving its hands free. The target also gains a Climb Speed equal to its Speed.

Using a Higher-Level Spell Slot. You can target one additional creature for each spell slot level above 2.",https://www.dndbeyond.com/spells/2619071-spider-climb,Movement Enhancement,Primary,Hard Ban,Secondary,Hard Ban,Primary
2nd,Spiritual Weapon,Evocation,1 Bonus Action,60 ft.,,"V, S",,1 Minute,,,Melee,Force,,"You create a floating, spectral force that resembles a weapon of your choice and lasts for the duration. The force appears within range in a space of your choice, and you can immediately make one melee spell attack against one creature within 5 feet of the force. On a hit, the target takes Force damage equal to 1d8 plus your spellcasting ability modifier.

As a Bonus Action on your later turns, you can move the force up to 20 feet and repeat the attack against a creature within 5 feet of it.

Using a Higher-Level Spell Slot. The damage increases by 1d8 for every slot level above 2.",https://www.dndbeyond.com/spells/2619081-spiritual-weapon,Force Manipulation,Primary,Hard Ban,Hard Ban,Secondary,Primary
2nd,Summon Beast,Conjuration,1 Action,90 ft.,,"V, S, M",,1 Hour,,,,Summoning,,"You call forth a bestial spirit. It manifests in an unoccupied space that you can see within range and uses the Bestial Spirit stat block. When you cast the spell, choose an environment: Air, Land, or Water. The creature resembles an animal of your choice that is native to the chosen environment, which determines certain details in its stat block. The creature disappears when it drops to 0 Hit Points or when the spell ends.

The creature is an ally to you and your allies. In combat, the creature shares your Initiative count, but it takes its turn immediately after yours. It obeys your verbal commands (no action required by you). If you don’t issue any, it takes the Dodge action and uses its movement to avoid danger.

Using a Higher-Level Spell Slot. Use the spell slot’s level for the spell’s level in the stat block.

Small Beast, Neutral

AC 11 + the spell’s level

HP 20 (Air only) or 30 (Land and Water only) + 5 for each spell level above 2

Speed 30 ft.; Climb 30 ft. (Land only); Fly 60 ft. (Air only); Swim 30 ft. (Water only)

Senses Darkvision 60 ft.; Passive Perception 12

Languages Understands the languages you know

CR None (XP 0; PB equals your Proficiency Bonus)

Traits

Flyby (Air Only). The spirit doesn’t provoke Opportunity Attacks when it flies out of an enemy’s reach.

Pack Tactics (Land and Water Only). The spirit has Advantage on an attack roll against a creature if at least one of the spirit’s allies is within 5 feet of the creature and the ally doesn’t have the Incapacitated condition.

Water Breathing (Water Only). The spirit can breathe only underwater.

Actions

Multiattack. The spirit makes a number of Rend attacks equal to half this spell’s level (round down).

Rend. Melee Attack Roll: Bonus equals your spell attack modifier, reach 5 ft. Hit: 1d8 + 4 + the spell’s level Piercing damage.",https://www.dndbeyond.com/spells/2619106-summon-beast,Movement Enhancement,Primary,Hard Ban,Secondary,Hard Ban,Primary
2nd,Vortex Warp,Conjuration,1 Action,90 ft.,,"V, S",,Instantaneous,,,CON Save,Teleportation,,,https://www.dndbeyond.com/spells/1239805-vortex-warp,Teleportation & Spatial Bending,Primary,Hard Ban,Hard Ban,Hard Ban,Hard Ban
2nd,Warp Sense,Divination,1 Action,,,"V, S, M",,1 Minute,,,,Detection (...),,,https://www.dndbeyond.com/spells/2119579-warp-sense,Divination — Detection,Secondary,Hard Ban,Secondary,Hard Ban,Primary
3rd,Blink,Transmutation,1 Action,,,"V, S",,1 Minute,,,,Utility,,"Roll 1d6 at the end of each of your turns for the duration. On a roll of 4–6, you vanish from your current plane of existence and appear in the Ethereal Plane (the spell ends instantly if you are already on that plane). While on the Ethereal Plane, you can perceive the plane you left, which is cast in shades of gray, but you can’t see anything there more than 60 feet away. You can affect and be affected only by other creatures on the Ethereal Plane, and creatures on the other plane can’t perceive you unless they have a special ability that lets them perceive things on the Ethereal Plane.

You return to the other plane at the start of your next turn and when the spell ends if you are on the Ethereal Plane. You return to an unoccupied space of your choice that you can see within 10 feet of the space you left. If no unoccupied space is available within that range, you appear in the nearest unoccupied space.",https://www.dndbeyond.com/spells/2618939-blink,Teleportation & Spatial Bending,Primary,Hard Ban,Hard Ban,Hard Ban,Hard Ban
3rd,Clairvoyance,Divination,10 Minutes,1 mile,,"V, S, M",,10 Minutes,,,,Detection (...),,"You create an Invisible sensor within range in a location familiar to you (a place you have visited or seen before) or in an obvious location that is unfamiliar to you (such as behind a door, around a corner, or in a grove of trees). The intangible, invulnerable sensor remains in place for the duration.

When you cast the spell, choose seeing or hearing. You can use the chosen sense through the sensor as if you were in its space. As a Bonus Action, you can switch between seeing and hearing.

A creature that sees the sensor (such as a creature benefiting from See Invisibility or Truesight ) sees a luminous orb about the size of your fist.",https://www.dndbeyond.com/spells/2618972-clairvoyance,Divination — Detection,Secondary,Hard Ban,Secondary,Hard Ban,Primary
3rd,Conjure Barrage,Conjuration,1 Action,,(60 ft. ),"V, S, M",,Instantaneous,,,DEX Save,Force,,"You brandish the weapon used to cast the spell and conjure similar spectral weapons (or ammunition appropriate to the weapon) that launch forward and then disappear. Each creature of your choice that you can see in a 60-foot Cone makes a Dexterity saving throw, taking 5d8 Force damage on a failed save or half as much damage on a successful one.

Using a Higher-Level Spell Slot. The damage increases by 1d8 for each spell slot level above 3.",https://www.dndbeyond.com/spells/2619045-conjure-barrage,Force Manipulation,Primary,Hard Ban,Hard Ban,Secondary,Primary
3rd,Counterspell,Abjuration,1 Reaction *,60 ft.,,S,,Instantaneous,,,CON Save,Negation,,"You attempt to interrupt a creature in the process of casting a spell. The creature makes a Constitution saving throw. On a failed save, the spell dissipates with no effect, and the action, Bonus Action, or Reaction used to cast it is wasted. If that spell was cast with a spell slot, the slot isn’t expended.",https://www.dndbeyond.com/spells/2619072-counterspell,Anti-Magic / Nullification,Exclusive,Hard Ban,Hard Ban,Hard Ban,Hard Ban
3rd,Daylight,Evocation,1 Action,60 ft.,(60 ft. ),"V, S",,1 Hour,,,,Control,,"For the duration, sunlight spreads from a point within range and fills a 60-foot-radius Sphere . The sunlight’s area is Bright Light and sheds Dim Light for an additional 60 feet.

Alternatively, you cast the spell on an object that isn’t being worn or carried, causing the sunlight to fill a 60-foot Emanation originating from that object. Covering that object with something opaque, such as a bowl or helm, blocks the sunlight.

If any of this spell’s area overlaps with an area of Darkness created by a spell of level 3 or lower, that other spell is dispelled.",https://www.dndbeyond.com/spells/2619083-daylight,Illusions & Glamours,Exclusive,Hard Ban,Hard Ban,Hard Ban,Hard Ban
3rd,Dispel Magic,Abjuration,1 Action,120 ft.,,"V, S",,Instantaneous,,,,Control,,"Choose one creature, object, or magical effect within range. Any ongoing spell of level 3 or lower on the target ends. For each ongoing spell of level 4 or higher on the target, make an ability check using your spellcasting ability (DC 10 plus that spell’s level). On a successful check, the spell ends.

Using a Higher-Level Spell Slot. You automatically end a spell on the target if the spell’s level is equal to or less than the level of the spell slot you use.",https://www.dndbeyond.com/spells/2619103-dispel-magic,Anti-Magic / Nullification,Exclusive,Hard Ban,Hard Ban,Hard Ban,Hard Ban
