Level,Name,School,Casting Time,Range,Area,Components,Materials,Duration,Concentration,Ritual,Attack/Save,Damage/Effect,Source,Description,URL_absolute,Primary Effect Category,Arcane Status,Divine Status,Nature Status,Elemental Status,Psionics Status
3rd,Fear,Illusion,1 Action,,(30 ft. ),"V, S, M",,1 Minute,,,WIS Save,Frightened,,"Each creature in a 30-foot Cone must succeed on a Wisdom saving throw or drop whatever it is holding and have the Frightened condition for the duration.

A Frightened creature takes the Dash action and moves away from you by the safest route on each of its turns unless there is nowhere to move. If the creature ends its turn in a space where it doesn’t have line of sight to you, the creature makes a Wisdom saving throw. On a successful save, the spell ends on that creature.",https://www.dndbeyond.com/spells/2618872-fear,Illusions & Glamours,Exclusive,Hard Ban,Hard Ban,Hard Ban,Hard Ban
3rd,Fly,Transmutation,1 Action,,,"V, S, M",,10 Minutes,,,,Movement,,"You touch a willing creature. For the duration, the target gains a Fly Speed of 60 feet and can hover. When the spell ends, the target falls if it is still aloft unless it can stop the fall.

Using a Higher-Level Spell Slot. You can target one additional creature for each spell slot level above 3.",https://www.dndbeyond.com/spells/2618909-fly,Movement Enhancement,Primary,Hard Ban,Secondary,Hard Ban,Primary
3rd,Haste,Transmutation,1 Action,30 ft.,,"V, S, M",,1 Minute,,,,Buff,,"Choose a willing creature that you can see within range. Until the spell ends, the target’s Speed is doubled, it gains a +2 bonus to Armor Class, it has Advantage on Dexterity saving throws, and it gains an additional action on each of its turns. That action can be used to take only the Attack (one attack only), Dash , Disengage , Hide , or Utilize action.

When the spell ends, the target is Incapacitated and has a Speed of 0 until the end of its next turn, as a wave of lethargy washes over it.",https://www.dndbeyond.com/spells/2619141-haste,Time Manipulation,Exclusive,Hard Ban,Hard Ban,Hard Ban,Secondary
3rd,Hypnotic Pattern,Illusion,1 Action,120 ft.,(30 ft. ),"S, M",,1 Minute,,,WIS Save,Charmed (...),,"You create a twisting pattern of colors in a 30-foot Cube within range. The pattern appears for a moment and vanishes. Each creature in the area who can see the pattern must succeed on a Wisdom saving throw or have the Charmed condition for the duration. While Charmed, the creature has the Incapacitated condition and a Speed of 0.

The spell ends for an affected creature if it takes any damage or if someone else uses an action to shake the creature out of its stupor.",https://www.dndbeyond.com/spells/2619168-hypnotic-pattern,Illusions & Glamours,Exclusive,Hard Ban,Hard Ban,Hard Ban,Hard Ban
3rd,Major Image,Illusion,1 Action,120 ft.,(20 ft. *),"V, S, M",,10 Minutes,,,,Control,,"You create the image of an object, a creature, or some other visible phenomenon that is no larger than a 20-foot Cube . The image appears at a spot that you can see within range and lasts for the duration. It seems real, including sounds, smells, and temperature appropriate to the thing depicted, but it can’t deal damage or cause conditions.

If you are within range of the illusion, you can take a Magic action to cause the image to move to any other spot within range. As the image changes location, you can alter its appearance so that its movements appear natural for the image. For example, if you create an image of a creature and move it, you can alter the image so that it appears to be walking. Similarly, you can cause the illusion to make different sounds at different times, even making it carry on a conversation, for example.

Physical interaction with the image reveals it to be an illusion, for things can pass through it. A creature that takes a Study action to examine the image can determine that it is an illusion with a successful Intelligence ( Investigation ) check against your spell save DC. If a creature discerns the illusion for what it is, the creature can see through the image, and its other sensory qualities become faint to the creature.

Using a Higher-Level Spell Slot. The spell lasts until dispelled, without requiring Concentration , if cast with a level 4+ spell slot.",https://www.dndbeyond.com/spells/2619025-major-image,Illusions & Glamours,Exclusive,Hard Ban,Hard Ban,Hard Ban,Hard Ban
3rd,Meld into Stone,Transmutation,1 Action,,,"V, S",,8 Hours,,,,Movement,,"You step into a stone object or surface large enough to fully contain your body, merging yourself and your equipment with the stone for the duration. You must touch the stone to do so. Nothing of your presence remains visible or otherwise detectable by nonmagical senses.

While merged with the stone, you can’t see what occurs outside it, and any Wisdom ( Perception ) checks you make to hear sounds outside it are made with Disadvantage. You remain aware of the passage of time and can cast spells on yourself while merged in the stone. You can use 5 feet of movement to leave the stone where you entered it, which ends the spell. You otherwise can’t move.

Minor physical damage to the stone doesn’t harm you, but its partial destruction or a change in its shape (to the extent that you no longer fit within it) expels you and deals 6d6 Force damage to you. The stone’s complete destruction (or transmutation into a different substance) expels you and deals 50 Force damage to you. If expelled, you move into an unoccupied space closest to where you first entered and have the Prone condition.",https://www.dndbeyond.com/spells/2619031-meld-into-stone,Transformation / Polymorph,Primary,Hard Ban,Secondary,Hard Ban,Hard Ban
3rd,Phantom Steed,Illusion,1 Minute,30 ft.,,"V, S",,1 Hour,,,,Movement,,"A Large, quasi-real, horselike creature appears on the ground in an unoccupied space of your choice within range. You decide the creature’s appearance, and it is equipped with a saddle, bit, and bridle. Any of the equipment created by the spell vanishes in a puff of smoke if it is carried more than 10 feet away from the steed.

For the duration, you or a creature you choose can ride the steed. The steed uses the Riding Horse stat block, except it has a Speed of 100 feet and can travel 13 miles in an hour. When the spell ends, the steed gradually fades, giving the rider 1 minute to dismount. The spell ends early if the steed takes any damage.",https://www.dndbeyond.com/spells/2618859-phantom-steed,Movement Enhancement,Primary,Hard Ban,Secondary,Hard Ban,Primary
3rd,Thunder Step,Conjuration,1 Action,90 ft.,,V,,Instantaneous,,,CON Save,Thunder,,"You teleport yourself to an unoccupied space you can see within range. Immediately after you disappear, a thunderous boom sounds, and each creature within 10 feet of the space you left must make a Constitution saving throw, taking 3d10 thunder damage on a failed save, or half as much damage on a successful one. The thunder can be heard from up to 300 feet away.

You can bring along objects as long as their weight doesn’t exceed what you can carry. You can also teleport one willing creature of your size or smaller who is carrying gear up to its carrying capacity. The creature must be within 5 feet of you when you cast this spell, and there must be an unoccupied space within 5 feet of your destination space for the creature to appear in; otherwise, the creature is left behind.

At Higher Levels. When you cast this spell using a spell slot of 4th level or higher, the damage increases by 1d10 for each slot level above 3rd.",https://www.dndbeyond.com/spells/14613-thunder-step,Teleportation & Spatial Bending,Primary,Hard Ban,Hard Ban,Hard Ban,Hard Ban
3rd,Tiny Servant,Transmutation,1 Minute,,,"V, S",,8 Hours,,,,Utility,,"You touch one Tiny, nonmagical object that isn’t attached to another object or a surface and isn’t being carried by another creature. The target animates and sprouts little arms and legs, becoming a creature under your control until the spell ends or the creature drops to 0 hit points. See Tiny Servant for its statistics.

As a bonus action, you can mentally command the creature if it is within 120 feet of you. (If you control multiple creatures with this spell, you can command any or all of them at the same time, issuing the same command to each one.) You decide what action the creature will take and where it will move during its next turn, or you can issue a simple, general command, such as to fetch a key, stand watch, or stack some books. If you issue no commands, the servant does nothing other than defend itself against hostile creatures. Once given an order, the servant continues to follow that order until its task is complete.

When the creature drops to 0 hit points, it reverts to its original form, and any remaining damage carries over to that form.

At Higher Levels. When you cast this spell using a spell slot of 4th level or higher, you can animate two additional objects for each slot level above 3rd.",https://www.dndbeyond.com/spells/14614-tiny-servant,Constructs / Artifice,Exclusive,Hard Ban,Hard Ban,Hard Ban,Hard Ban
3rd,Water Breathing,Transmutation,1 Action,30 ft.,,"V, S, M",,24 Hours,,,,Buff,,This spell grants up to ten willing creatures of your choice within range the ability to breathe underwater until the spell ends. Affected creatures also retain their normal mode of respiration.,https://www.dndbeyond.com/spells/2619205-water-breathing,Transformation / Polymorph,Primary,Hard Ban,Secondary,Hard Ban,Hard Ban
3rd,Water Walk,Transmutation,1 Action,30 ft.,,"V, S, M",,1 Hour,,,,Movement,,"This spell grants the ability to move across any liquid surface—such as water, acid, mud, snow, quicksand, or lava—as if it were harmless solid ground (creatures crossing molten lava can still take damage from the heat). Up to ten willing creatures of your choice within range gain this ability for the duration.

An affected target must take a Bonus Action to pass from the liquid’s surface into the liquid itself and vice versa, but if the target falls into the liquid, the target passes through the surface into the liquid below.",https://www.dndbeyond.com/spells/2619207-water-walk,Movement Enhancement,Primary,Hard Ban,Secondary,Hard Ban,Primary
4th,Arcane Eye,Divination,1 Action,30 ft.,,"V, S, M",,1 Hour,,,,Detection,,"You create an Invisible , invulnerable eye within range that hovers for the duration. You mentally receive visual information from the eye, which can see in every direction. It also has Darkvision with a range of 30 feet.

As a Bonus Action, you can move the eye up to 30 feet in any direction. A solid barrier blocks the eye’s movement, but the eye can pass through an opening as small as 1 inch in diameter.",https://www.dndbeyond.com/spells/2618863-arcane-eye,Divination — Detection,Secondary,Hard Ban,Secondary,Hard Ban,Primary
4th,Dimension Door,Conjuration,1 Action,500 ft.,,V,,Instantaneous,,,,Teleportation,,"You teleport to a location within range. You arrive at exactly the spot desired. It can be a place you can see, one you can visualize, or one you can describe by stating distance and direction, such as “200 feet straight downward” or “300 feet upward to the northwest at a 45-degree angle.”

You can also teleport one willing creature. The creature must be within 5 feet of you when you teleport, and it teleports to a space within 5 feet of your destination space.

If you, the other creature, or both would arrive in a space occupied by a creature or completely filled by one or more objects, you and any creature traveling with you each take 4d6 Force damage, and the teleportation fails.",https://www.dndbeyond.com/spells/2619100-dimension-door,Teleportation & Spatial Bending,Primary,Hard Ban,Hard Ban,Hard Ban,Hard Ban
4th,Fabricate,Transmutation,10 Minutes,120 ft.,( ),"V, S",,Instantaneous,,,,Creation,,"You convert raw materials into products of the same material. For example, you can fabricate a wooden bridge from a clump of trees, a rope from a patch of hemp, or clothes from flax or wool.

Choose raw materials that you can see within range. You can fabricate a Large or smaller object (contained within a 10-foot Cube or eight connected 5-foot Cubes) given a sufficient quantity of material. If you’re working with metal, stone, or another mineral substance, however, the fabricated object can be no larger than Medium (contained within a 5-foot Cube). The quality of any fabricated objects is based on the quality of the raw materials.

Creatures and magic items can’t be created by this spell. You also can’t use it to create items that require a high degree of skill—such as weapons and armor—unless you have proficiency with the type of Artisan’s Tools used to craft such objects.",https://www.dndbeyond.com/spells/2618848-fabricate,Constructs / Artifice,Exclusive,Hard Ban,Hard Ban,Hard Ban,Hard Ban
4th,Greater Invisibility,Illusion,1 Action,,,"V, S",,1 Minute,,,,Invisible,,A creature you touch has the Invisible condition until the spell ends.,https://www.dndbeyond.com/spells/2618958-greater-invisibility,Illusions & Glamours,Exclusive,Hard Ban,Hard Ban,Hard Ban,Hard Ban
4th,Hallucinatory Terrain,Illusion,10 Minutes,300 ft.,(150 ft. ),"V, S, M",,24 Hours,,,,Control,,"You make natural terrain in a 150-foot Cube in range look, sound, and smell like another sort of natural terrain. Thus, open fields or a road can be made to resemble a swamp, hill, crevasse, or some other difficult or impassable terrain. A pond can be made to seem like a grassy meadow, a precipice like a gentle slope, or a rock-strewn gully like a wide and smooth road. Manufactured structures, equipment, and creatures within the area aren’t changed.

The tactile characteristics of the terrain are unchanged, so creatures entering the area are likely to notice the illusion. If the difference isn’t obvious by touch, a creature examining the illusion can take the Study action to make an Intelligence ( Investigation ) check against your spell save DC to disbelieve it. If a creature discerns that the terrain is illusory, the creature sees a vague image superimposed on the real terrain.",https://www.dndbeyond.com/spells/2619139-hallucinatory-terrain,Illusions & Glamours,Exclusive,Hard Ban,Hard Ban,Hard Ban,Hard Ban
4th,Locate Creature,Divination,1 Action,,,"V, S, M",,1 Hour,,,,Detection,,"Describe or name a creature that is familiar to you. You sense the direction to the creature’s location if that creature is within 1,000 feet of you. If the creature is moving, you know the direction of its movement.

The spell can locate a specific creature known to you or the nearest creature of a specific kind (such as a human or a unicorn) if you have seen such a creature up close—within 30 feet—at least once. If the creature you described or named is in a different form, such as under the effects of a Flesh to Stone or Polymorph spell, this spell doesn’t locate the creature.

This spell can’t locate a creature if any thickness of lead blocks a direct path between you and the creature.",https://www.dndbeyond.com/spells/2619001-locate-creature,Transformation / Polymorph,Primary,Hard Ban,Secondary,Hard Ban,Hard Ban
4th,Mordenkainen's Private Sanctum,Abjuration,10 Minutes,120 ft.,( *),"V, S, M",,24 Hours,,,,Control (...),,"You make an area within range magically secure. The area is a Cube that can be as small as 5 feet to as large as 100 feet on each side. The spell lasts for the duration.

When you cast the spell, you decide what sort of security the spell provides, choosing any of the following properties:

Sound can’t pass through the barrier at the edge of the warded area.

The barrier of the warded area appears dark and foggy, preventing vision (including Darkvision ) through it.

Sensors created by Divination spells can’t appear inside the protected area or pass through the barrier at its perimeter.

Creatures in the area can’t be targeted by Divination spells.

Nothing can teleport into or out of the warded area.

Planar travel is blocked within the warded area.

Casting this spell on the same spot every day for 365 days makes the spell last until dispelled.

Using a Higher-Level Spell Slot. You can increase the size of the Cube by 100 feet for each spell slot level above 4.",https://www.dndbeyond.com/spells/2619114-mordenkainens-private-sanctum,Teleportation & Spatial Bending,Primary,Hard Ban,Hard Ban,Hard Ban,Hard Ban
4th,Phantasmal Killer,Illusion,1 Action,120 ft.,,"V, S",,1 Minute,,,WIS Save,Psychic,,"You tap into the nightmares of a creature you can see within range and create an illusion of its deepest fears, visible only to that creature. The target makes a Wisdom saving throw. On a failed save, the target takes 4d10 Psychic damage and has Disadvantage on ability checks and attack rolls for the duration. On a successful save, the target takes half as much damage, and the spell ends.

For the duration, the target makes a Wisdom saving throw at the end of each of its turns. On a failed save, it takes the Psychic damage again. On a successful save, the spell ends.

Using a Higher-Level Spell Slot. The damage increases by 1d10 for each spell slot level above 4.",https://www.dndbeyond.com/spells/2618857-phantasmal-killer,Illusions & Glamours,Exclusive,Hard Ban,Hard Ban,Hard Ban,Hard Ban
4th,Polymorph,Transmutation,1 Action,60 ft.,,"V, S, M",,1 Hour,,,WIS Save,Control (...),,"You attempt to transform a creature that you can see within range into a Beast. The target must succeed on a Wisdom saving throw or shape-shift into Beast form for the duration. That form can be any Beast you choose that has a Challenge Rating equal to or less than the target’s (or the target’s level if it doesn’t have a Challenge Rating). The target’s game statistics are replaced by the stat block of the chosen Beast, but the target retains its alignment, personality, creature type, Hit Points, and Hit Point Dice.

The target gains a number of Temporary Hit Points equal to the Hit Points of the Beast form. These Temporary Hit Points vanish if any remain when the spell ends. The spell ends early on the target if it has no Temporary Hit Points left.

The target is limited in the actions it can perform by the anatomy of its new form, and it can’t speak or cast spells.

The target’s gear melds into the new form. The creature can’t use or otherwise benefit from any of that equipment.",https://www.dndbeyond.com/spells/2618876-polymorph,Transformation / Polymorph,Primary,Hard Ban,Secondary,Hard Ban,Hard Ban
4th,Stoneskin,Transmutation,1 Action,,,"V, S, M",,1 Hour,,,,Buff,,"Until the spell ends, one willing creature you touch has Resistance to Bludgeoning, Piercing, and Slashing damage.",https://www.dndbeyond.com/spells/2619095-stoneskin,Transformation / Polymorph,Primary,Hard Ban,Secondary,Hard Ban,Hard Ban
4th,Summon Construct,Conjuration,1 Action,90 ft.,,"V, S, M",,1 Hour,,,,Summoning,,"You call forth the spirit of a Construct. It manifests in an unoccupied space that you can see within range and uses the Construct Spirit stat block. When you cast the spell, choose a material: Clay, Metal, or Stone. The creature resembles an animate statue (you determine the appearance) made of the chosen material, which determines certain details in its stat block. The creature disappears when it drops to 0 Hit Points or when the spell ends.

The creature is an ally to you and your allies. In combat, the creature shares your Initiative count, but it takes its turn immediately after yours. It obeys your verbal commands (no action required by you). If you don’t issue any, it takes the Dodge action and uses its movement to avoid danger.

Using a Higher-Level Spell Slot. Use the spell slot’s level for the spell’s level in the stat block.

Medium Construct, Neutral

AC 13 + the spell’s level

HP 40 + 15 for each spell level above 4

Speed 30 ft.

Resistances Poison

Immunities Charmed , Exhaustion , Frightened , Paralyzed , Poisoned

Senses Darkvision 60 ft.; Passive Perception 10

Languages Understands the languages you know

CR None (XP 0; PB equals your Proficiency Bonus)

Traits

Heated Body (Metal Only). A creature that hits the spirit with a melee attack or that starts its turn in a grapple with the spirit takes 1d10 Fire damage.

Stony Lethargy (Stone Only). When a creature starts its turn within 10 feet of the spirit, the spirit can target it with magical energy if the spirit can see it. Wisdom Saving Throw: DC equals your spell save DC, the target. Failure: Until the start of its next turn, the target can’t make Opportunity Attacks , and its Speed is halved.

Actions

Multiattack. The spirit makes a number of Slam attacks equal to half this spell’s level (round down).

Slam. Melee Attack Roll: Bonus equals your spell attack modifier, reach 5 ft. Hit: 1d8 + 4 + the spell’s level Bludgeoning damage.

Reactions

Berserk Lashing (Clay Only). Trigger: The spirit takes damage from a creature. Response: The spirit makes a Slam attack against that creature if possible, or the spirit moves up to half its Speed toward that creature without provoking Opportunity Attacks .",https://www.dndbeyond.com/spells/2619111-summon-construct,Constructs / Artifice,Exclusive,Hard Ban,Hard Ban,Hard Ban,Hard Ban
5th,Animate Objects,Transmutation,1 Action,120 ft.,,"V, S",,1 Minute,,,,Creation (...),,"Objects animate at your command. Choose a number of nonmagical objects within range that aren’t being worn or carried, aren’t fixed to a surface, and aren’t Gargantuan. The maximum number of objects is equal to your spellcasting ability modifier; for this number, a Medium or smaller target counts as one object, a Large target counts as two, and a Huge target counts as three.

Each target animates, sprouts legs, and becomes a Construct that uses the Animated Object stat block; this creature is under your control until the spell ends or until it is reduced to 0 Hit Points. Each creature you make with this spell is an ally to you and your allies. In combat, it shares your Initiative count and takes its turn immediately after yours.

Until the spell ends, you can take a Bonus Action to mentally command any creature you made with this spell if the creature is within 500 feet of you (if you control multiple creatures, you can command any of them at the same time, issuing the same command to each one). If you issue no commands, the creature takes the Dodge action and moves only to avoid harm. When the creature drops to 0 Hit Points, it reverts to its object form, and any remaining damage carries over to that form.

Using a Higher-Level Spell Slot. The creature’s Slam damage increases by 1d4 (Medium or smaller), 1d6 (Large), or 1d12 (Huge) for each spell slot level above 5.

Huge or Smaller Construct, Unaligned

AC 15

HP 10 (Medium or smaller), 20 (Large), 40 (Huge)

Speed 30 ft.

Immunities Poison, Psychic; Charmed , Exhaustion , Frightened , Paralyzed , Poisoned

Senses Blindsight 30 ft.; Passive Perception 6

Languages Understands the languages you know

CR None (XP 0; PB equals your Proficiency Bonus)

Actions

Slam. Melee Attack Roll: Bonus equals your spell attack modifier, reach 5 ft. Hit: Force damage equal to 1d4 + 3 (Medium or smaller), 2d6 + 3 + your spellcasting ability modifier (Large), or 2d12 + 3 + your spellcasting ability modifier (Huge).",https://www.dndbeyond.com/spells/2618855-animate-objects,Constructs / Artifice,Exclusive,Hard Ban,Hard Ban,Hard Ban,Hard Ban
5th,Banishing Smite,Conjuration,1 Bonus Action *,,,V,,1 Minute,,,CHA Save,Force,,"The target hit by the attack roll takes an extra 5d10 Force damage from the attack. If the attack reduces the target to 50 Hit Points or fewer, the target must succeed on a Charisma saving throw or be transported to a harmless demiplane for the duration. While there, the target has the Incapacitated condition. When the spell ends, the target reappears in the space it left or in the nearest unoccupied space if that space is occupied.",https://www.dndbeyond.com/spells/2618904-banishing-smite,Teleportation & Spatial Bending,Primary,Hard Ban,Hard Ban,Hard Ban,Hard Ban
