Level,Name,School,Casting Time,Range,Area,Components,Materials,Duration,Concentration,Ritual,Attack/Save,Damage/Effect,Source,Description,URL_absolute,Primary Effect Category,Arcane Status,Divine Status,Nature Status,Elemental Status,Psionics Status
5th,Summon Dragon,Conjuration,1 Action,60 ft.,,"V, S, M",,1 Hour,,,,,,"You call forth a Dragon spirit. It manifests in an unoccupied space that you can see within range and uses the Draconic Spirit stat block. The creature disappears when it drops to 0 Hit Points or when the spell ends.

The creature is an ally to you and your allies. In combat, the creature shares your Initiative count, but it takes its turn immediately after yours. It obeys your verbal commands (no action required by you). If you don’t issue any, it takes the Dodge action and uses its movement to avoid danger.

Using a Higher-Level Spell Slot. Use the spell slot’s level for the spell’s level in the stat block.

Large Dragon, Neutral

AC 14 + the spell’s level

HP 50 + 10 for each spell level above 5

Speed 30 ft., Fly 60 ft., Swim 30 ft.

Resistances Acid, Cold, Fire, Lightning, Poison

Immunities Charmed , Frightened , Poisoned

Senses Blindsight 30 ft., Darkvision 60 ft.; Passive Perception 12

Languages Draconic, understands the languages you know

CR None (XP 0; PB equals your Proficiency Bonus)

Traits

Shared Resistances. When you summon the spirit, choose one of its Resistances. You have Resistance to the chosen damage type until the spell ends.

Actions

Multiattack. The spirit makes a number of Rend attacks equal to half the spell’s level (round down), and it uses Breath Weapon.

Rend. Melee Attack Roll: Bonus equals your spell attack modifier, reach 10 feet. Hit: 1d6 + 4 + the spell’s level Piercing damage.

Breath Weapon. Dexterity Saving Throw: DC equals your spell save DC, each creature in a 30-foot Cone . Failure: 2d6 damage of a type this spirit has Resistance to (your choice when you cast the spell). Success: Half damage.",https://www.dndbeyond.com/spells/2618843-summon-dragon,Summoning — Extraplanar,Hard Ban,Secondary,Hard Ban,Hard Ban,Hard Ban
5th,Yolande's Regal Presence,Enchantment,1 Action,,(10 ft. ),"V, S, M",,1 Minute,,,WIS Save,Psychic,,"You surround yourself with unearthly majesty in a 10-foot Emanation. Whenever the Emanation enters the space of a creature you can see and whenever a creature you can see enters the Emanation or ends its turn there, you can force that creature to make a Wisdom saving throw. On a failed save, the target takes 4d6 Psychic damage and has the Prone condition, and you can push it up to 10 feet away. On a successful save, the target takes half as much damage only. A creature makes this save only once per turn.",https://www.dndbeyond.com/spells/2618842-yolandes-regal-presence,Conditions & Debuffs,Hard Ban,Primary,Hard Ban,Hard Ban,Secondary
6th,Contingency,Abjuration,10 Minutes,,,"V, S, M",,10 Days,,,,Utility,,"Choose a spell of level 5 or lower that you can cast, that has a casting time of an action, and that can target you. You cast that spell—called the contingent spell—as part of casting Contingency , expending spell slots for both, but the contingent spell doesn’t come into effect. Instead, it takes effect when a certain trigger occurs. You describe that trigger when you cast the two spells. For example, a Contingency cast with Water Breathing might stipulate that Water Breathing comes into effect when you are engulfed in water or a similar liquid.

The contingent spell takes effect immediately after the trigger occurs for the first time, whether or not you want it to, and then Contingency ends.

The contingent spell takes effect only on you, even if it can normally target others. You can use only one Contingency spell at a time. If you cast this spell again, the effect of another Contingency spell on you ends. Also, Contingency ends on you if its material component is ever not on your person.",https://www.dndbeyond.com/spells/2619053-contingency,Wards & Sanctuaries,Hard Ban,Primary,Hard Ban,Hard Ban,Hard Ban
6th,Find the Path,Divination,1 Minute,,,"V, S, M",,1 Day,,,,Detection,,"You magically sense the most direct physical route to a location you name. You must be familiar with the location, and the spell fails if you name a destination on another plane of existence, a moving destination (such as a mobile fortress), or an unspecific destination (such as “a green dragon’s lair”).

For the duration, as long as you are on the same plane of existence as the destination, you know how far it is and in what direction it lies. Whenever you face a choice of paths along the way there, you know which path is the most direct.",https://www.dndbeyond.com/spells/2618881-find-the-path,Divination — Omens & Revelation,Hard Ban,Exclusive,Hard Ban,Hard Ban,Hard Ban
6th,Fizban's Platinum Shield,Abjuration,1 Bonus Action,60 ft.,,"V, S, M",,1 Minute,,,,Warding,,,https://www.dndbeyond.com/spells/1183864-fizbans-platinum-shield,Wards & Sanctuaries,Hard Ban,Primary,Hard Ban,Hard Ban,Hard Ban
6th,Heal,Abjuration,1 Action,60 ft.,,"V, S",,Instantaneous,,,,Blinded (...),,"Choose a creature that you can see within range. Positive energy washes through the target, restoring 70 Hit Points. This spell also ends the Blinded , Deafened , and Poisoned conditions on the target.

Using a Higher-Level Spell Slot. The healing increases by 10 for each spell slot level above 6.",https://www.dndbeyond.com/spells/2618979-heal,Healing & Restoration,Hard Ban,Primary,Hard Ban,Primary,Hard Ban
6th,Magic Jar,Necromancy,1 Minute,,,"V, S, M",,Until Dispelled,,,CHA Save,Control,,"Your body falls into a catatonic state as your soul leaves it and enters the container you used for the spell’s Material component. While your soul inhabits the container, you are aware of your surroundings as if you were in the container’s space. You can’t move or take Reactions. The only action you can take is to project your soul up to 100 feet out of the container, either returning to your living body (and ending the spell) or attempting to possess a Humanoid’s body.

You can attempt to possess any Humanoid within 100 feet of you that you can see (creatures warded by a Protection from Evil and Good or Magic Circle spell can’t be possessed ). The target makes a Charisma saving throw. On a failed save, your soul enters the target’s body, and the target’s soul becomes trapped in the container. On a successful save, the target resists your efforts to possess it, and you can’t attempt to possess it again for 24 hours.

Once you possess a creature’s body, you control it. Your Hit Points, Hit Point Dice, Strength, Dexterity, Constitution, Speed, and senses are replaced by the creature’s. You otherwise keep your game statistics.

Meanwhile, the possessed creature’s soul can perceive from the container using its own senses, but it can’t move and it is Incapacitated .

While possessing a body, you can take a Magic action to return from the host body to the container if it is within 100 feet of you, returning the host creature’s soul to its body. If the host body dies while you’re in it, the creature dies, and you make a Charisma saving throw against your own spellcasting DC. On a success, you return to the container if it is within 100 feet of you. Otherwise, you die.

If the container is destroyed or the spell ends, your soul returns to your body. If your body is more than 100 feet away from you or if your body is dead, you die. If another creature’s soul is in the container when it is destroyed, the creature’s soul returns to its body if the body is alive and within 100 feet. Otherwise, that creature dies.

When the spell ends, the container is destroyed.",https://www.dndbeyond.com/spells/2619021-magic-jar,Wards & Sanctuaries,Hard Ban,Primary,Hard Ban,Hard Ban,Hard Ban
6th,Primordial Ward,Abjuration,1 Action,,,"V, S",,1 Minute,,,,Warding,,"You have resistance to acid, cold, fire, lightning, and thunder damage for the spell’s duration.

When you take damage of one of those types, you can use your reaction to gain immunity to that type of damage, including against the triggering damage.

If you do so, the resistances end, and you have the immunity until the end of your next turn, at which time the spell ends.",https://www.dndbeyond.com/spells/2395-primordial-ward,Wards & Sanctuaries,Hard Ban,Primary,Hard Ban,Hard Ban,Hard Ban
6th,Soul Cage,Necromancy,1 Reaction *,60 ft.,,"V, S, M",,8 Hours,,,,Buff (...),,"This spell snatches the soul of a humanoid as it dies and traps it inside the tiny cage you use for the material component. A stolen soul remains inside the cage until the spell ends or until you destroy the cage, which ends the spell. While you have a soul inside the cage, you can exploit it in any of the ways described below. You can use a trapped soul up to six times. Once you exploit a soul for the sixth time, it is released, and the spell ends. While a soul is trapped, the dead humanoid it came from can’t be revived.

Steal Life. You can use a bonus action to drain vigor from the soul and regain 2d8 hit points.

Query Soul. You ask the soul a question (no action required) and receive a brief telepathic answer, which you can understand regardless of the language used. The soul knows only what it knew in life, but it must answer you truthfully and to the best of its ability. The answer is no more than a sentence or two and might be cryptic.

Borrow Experience. You can use a bonus action to bolster yourself with the soul’s life experience, making your next attack roll, ability check, or saving throw with advantage. If you don’t use this benefit before the start of your next turn, it is lost.

Eyes of the Dead. You can use an action to name a place the humanoid saw in life, which creates an invisible sensor somewhere in that place if it is on the plane of existence you’re currently on. The sensor remains for as long as you concentrate, up to 10 minutes (as if you were concentrating on a spell). You receive visual and auditory information from the sensor as if you were in its space using your senses.

A creature that can see the sensor (such as one using see invisibility or truesight ) sees a translucent image of the tormented humanoid whose soul you caged.",https://www.dndbeyond.com/spells/14601-soul-cage,Curses & Hexes,Hard Ban,Primary,Hard Ban,Hard Ban,Hard Ban
6th,Summon Fiend,Conjuration,1 Action,90 ft.,,"V, S, M",,1 Hour,,,,Summoning,,"You call forth a fiendish spirit. It manifests in an unoccupied space that you can see within range and uses the Fiendish Spirit stat block. When you cast the spell, choose Demon, Devil, or Yugoloth. The creature resembles a Fiend of the chosen type, which determines certain details in its stat block. The creature disappears when it drops to 0 Hit Points or when the spell ends.

The creature is an ally to you and your allies. In combat, the creature shares your Initiative count, but it takes its turn immediately after yours. It obeys your verbal commands (no action required by you). If you don’t issue any, it takes the Dodge action and uses its movement to avoid danger.

Using a Higher-Level Spell Slot. Use the spell slot’s level for the spell’s level in the stat block.

Large Fiend, Neutral

AC 12 + the spell’s level

HP 50 (Demon only) or 40 (Devil only) or 60 (Yugoloth only) + 15 for each spell level above 6

Speed 40 ft.; Climb 40 ft. (Demon only); Fly 60 ft. (Devil only)

Resistances Fire

Immunities Poison; Poisoned

Senses Darkvision 60 ft.; Passive Perception 10

Languages Abyssal, Infernal; telepathy 60 ft.

CR None (XP 0; PB equals your Proficiency Bonus)

Traits

Death Throes (Demon Only). When the spirit drops to 0 Hit Points or the spell ends, the spirit explodes. Dexterity Saving Throw: DC equals your spell save DC, each creature in a 10-foot Emanation originating from the spirit. Failure: 2d10 plus this spell’s level Fire damage. Success: Half damage.

Devil’s Sight (Devil Only). Magical Darkness doesn’t impede the spirit’s Darkvision .

Magic Resistance. The spirit has Advantage on saving throws against spells and other magical eff ects.

Actions

Multiattack. The spirit makes a number of attacks equal to half this spell’s level (round down).

Bite (Demon Only). Melee Attack Roll: Bonus equals your spell attack modifier, reach 5 ft. Hit: 1d12 + 3 + the spell’s level Necrotic damage.

Claws (Yugoloth Only). Melee Attack Roll: Bonus equals your spell attack modifier, reach 5 ft. Hit: 1d8 + 3 + the spell’s level Slashing damage. Immediately after the attack hits or misses, the spirit can teleport up to 30 feet to an unoccupied space it can see.

Fiery Strike (Devil Only). Melee or Ranged Attack Roll: Bonus equals your spell attack modifier, reach 5 ft. or range 150 ft. Hit: 2d6 + 3 + the spell’s level Fire damage.",https://www.dndbeyond.com/spells/2619117-summon-fiend,Summoning — Extraplanar,Hard Ban,Secondary,Hard Ban,Hard Ban,Hard Ban
6th,Tenser's Transformation,Transmutation,1 Action,,,"V, S, M",,10 Minutes,,,,Buff (...),,"You endow yourself with endurance and martial prowess fueled by magic. Until the spell ends, you can’t cast spells, and you gain the following benefits:

You gain 50 temporary hit points. If any of these remain when the spell ends, they are lost.

You have advantage on attack rolls that you make with simple and martial weapons.

When you hit a target with a weapon attack, that target takes an extra 2d12 force damage.

You have proficiency with all armor, shields, simple weapons, and martial weapons.

You have proficiency in Strength and Constitution saving throws.

You can attack twice, instead of once, when you take the Attack action on your turn. You ignore this benefit if you already have a feature, like Extra Attack, that gives you extra attacks.

Immediately after the spell ends, you must succeed on a DC 15 Constitution saving throw or suffer one level of exhaustion .",https://www.dndbeyond.com/spells/14612-tensers-transformation,Conditions & Debuffs,Hard Ban,Primary,Hard Ban,Hard Ban,Secondary
7th,Conjure Celestial,Conjuration,1 Action,90 ft.,(10 ft. *),"V, S",,10 Minutes,,,DEX Save,Radiant,,"You conjure a spirit from the Upper Planes, which manifests as a pillar of light in a 10-foot-radius, 40-foot-high Cylinder centered on a point within range. For each creature you can see in the Cylinder, choose which of these lights shines on it:

Healing Light. The target regains Hit Points equal to 4d12 plus your spellcasting ability modifier.

Searing Light. The target makes a Dexterity saving throw, taking 6d12 Radiant damage on a failed save or half as much damage on a successful one.

Until the spell ends, Bright Light fills the Cylinder, and when you move on your turn, you can also move the Cylinder up to 30 feet.

Whenever the Cylinder moves into the space of a creature you can see and whenever a creature you can see enters the Cylinder or ends its turn there, you can bathe it in one of the lights. A creature can be affected by this spell only once per turn.

Using a Higher-Level Spell Slot. The healing and damage increase by 1d12 for each spell slot level above 7.",https://www.dndbeyond.com/spells/2619046-conjure-celestial,Healing & Restoration,Hard Ban,Primary,Hard Ban,Primary,Hard Ban
7th,Divine Word,Evocation,1 Bonus Action,30 ft.,,V,,Instantaneous,,,CHA Save,Deafened (...),,"You utter a word imbued with power from the Upper Planes. Each creature of your choice in range makes a Charisma saving throw. On a failed save, a target that has 50 Hit Points or fewer suffers an effect based on its current Hit Points, as shown in the Divine Word Effects table. Regardless of its Hit Points, a Celestial, an Elemental, a Fey, or a Fiend target that fails its save is forced back to its plane of origin (if it isn’t there already) and can’t return to the current plane for 24 hours by any means short of a Wish spell.",https://www.dndbeyond.com/spells/2619144-divine-word,Conditions & Debuffs,Hard Ban,Primary,Hard Ban,Hard Ban,Secondary
7th,Resurrection,Necromancy,1 Hour,,,"V, S, M",,Instantaneous,,,,Healing,,"With a touch, you revive a dead creature that has been dead for no more than a century, didn’t die of old age, and wasn’t Undead when it died.

The creature returns to life with all its Hit Points. This spell also neutralizes any poisons that affected the creature at the time of death. This spell closes all mortal wounds and restores any missing body parts.

Coming back from the dead is an ordeal. The target takes a −4 penalty to D20 Tests . Every time the target finishes a Long Rest, the penalty is reduced by 1 until it becomes 0.

Casting this spell to revive a creature that has been dead for 365 days or longer taxes you. Until you finish a Long Rest, you can’t cast spells again, and you have Disadvantage on D20 Tests.",https://www.dndbeyond.com/spells/2618953-resurrection,Resurrection,Hard Ban,Exclusive,Hard Ban,Hard Ban,Hard Ban
7th,Sequester,Transmutation,1 Action,,,"V, S, M",,Until Dispelled,,,,Invisible,,"With a touch, you magically sequester an object or a willing creature. For the duration, the target has the Invisible condition and can’t be targeted by Divination spells, detected by magic, or viewed remotely with magic.

If the target is a creature, it enters a state of suspended animation; it has the Unconscious condition, doesn’t age, and doesn’t need food, water, or air.

You can set a condition for the spell to end early. The condition can be anything you choose, but it must occur or be visible within 1 mile of the target. Examples include “after 1,000 years” or “when the tarrasque awakens.” This spell also ends if the target takes any damage.",https://www.dndbeyond.com/spells/2618980-sequester,Wards & Sanctuaries,Hard Ban,Primary,Hard Ban,Hard Ban,Hard Ban
7th,Temple of the Gods,Conjuration,1 Hour,120 ft.,,"V, S, M",,24 Hours,,,CHA Save,Creation (...),,"You cause a temple to shimmer into existence on ground you can see within range. The temple must fit within an unoccupied cube of space, up to 120 feet on each side. The temple remains until the spell ends. It is dedicated to whatever god, pantheon, or philosophy is represented by the holy symbol used in the casting.

You make all decisions about the temple’s appearance. The interior is enclosed by a floor, walls, and a roof, with one door granting access to the interior and as many windows as you wish. Only you and any creatures you designate when you cast the spell can open or close the door.

The temple’s interior is an open space with an idol or altar at one end. You decide whether the temple is illuminated and whether that illumination is bright light or dim light. The smell of burning incense fills the air within, and the temperature is mild.

The temple opposes types of creatures you choose when you cast this spell. Choose one or more of the following: celestials, elementals, fey, fiends, or undead. If a creature of the chosen type attempts to enter the temple, that creature must make a Charisma saving throw. On a failed save, it can’t enter the temple for 24 hours. Even if the creature can enter the temple, the magic there hinders it; whenever it makes an attack roll, an ability check, or a saving throw inside the temple, it must roll a d4 and subtract the number rolled from the d20 roll.

In addition, the sensors created by divination spells can’t appear inside the temple, and creatures within can’t be targeted by divination spells.

Finally, whenever any creature in the temple regains hit points from a spell of 1st level or higher, the creature regains additional hit points equal to your Wisdom modifier (minimum 1 hit point).

The temple is made from opaque magical force that extends into the Ethereal Plane, thus blocking ethereal travel into the temple’s interior. Nothing can physically pass through the temple’s exterior. It can’t be dispelled by dispel magic , and antimagic field has no effect on it. A disintegrate spell destroys the temple instantly.

Casting this spell on the same spot every day for a year makes this effect permanent.",https://www.dndbeyond.com/spells/14606-temple-of-the-gods,Healing & Restoration,Hard Ban,Primary,Hard Ban,Primary,Hard Ban
7th,Whirlwind,Evocation,1 Action,300 ft.,(10 ft. *),"V, M",,1 Minute,,,DEX Save,Bludgeoning,,"A whirlwind howls down to a point that you can see on the ground within range. The whirlwind is a 10-foot-radius, 30-foot-high cylinder centered on that point. Until the spell ends, you can use your action to move the whirlwind up to 30 feet in any direction along the ground. The whirlwind sucks up any Medium or smaller objects that aren’t secured to anything and that aren’t worn or carried by anyone.

A creature must make a Dexterity saving throw the first time on a turn that it enters the whirlwind or that the whirlwind enters its space, including when the whirlwind first appears. A creature takes 10d6 bludgeoning damage on a failed save, or half as much damage on a successful one. In addition, a Large or smaller creature that fails the save must succeed on a Strength saving throw or become restrained in the whirlwind until the spell ends. When a creature starts its turn restrained by the whirlwind, the creature is pulled 5 feet higher inside it, unless the creature is at the top. A restrained creature moves with the whirlwind and falls when the spell ends, unless the creature has some means to stay aloft.

A restrained creature can use an action to make a Strength or Dexterity check against your spell save DC. If successful, the creature is no longer restrained by the whirlwind and is hurled 3d6 × 10 feet away from it in a random direction.",https://www.dndbeyond.com/spells/2409-whirlwind,Conditions & Debuffs,Hard Ban,Primary,Hard Ban,Hard Ban,Secondary
8th,Befuddlement,Enchantment,1 Action,150 ft.,,"V, S, M",,Instantaneous,,,INT Save,Psychic,,"You blast the mind of a creature that you can see within range. The target makes an Intelligence saving throw.

On a failed save, the target takes 10d12 Psychic damage and can’t cast spells or take the Magic action. At the end of every 30 days, the target repeats the save, ending the effect on a success. The effect can also be ended by the Greater Restoration , Heal , or Wish spell.

On a successful save, the target takes half as much damage only.",https://www.dndbeyond.com/spells/2618832-befuddlement,Healing & Restoration,Hard Ban,Primary,Hard Ban,Primary,Hard Ban
8th,Glibness,Enchantment,1 Action,,,V,,1 Hour,,,,Social,,"Until the spell ends, when you make a Charisma check, you can replace the number you roll with a 15. Additionally, no matter what you say, magic that would determine if you are telling the truth indicates that you are being truthful.",https://www.dndbeyond.com/spells/2618948-glibness,Conditions & Debuffs,Hard Ban,Primary,Hard Ban,Hard Ban,Secondary
8th,Holy Aura,Abjuration,1 Action,,(30 ft. ),"V, S, M",,1 Minute,,,CON Save,Blinded,,"For the duration, you emit an aura in a 30-foot Emanation . While in the aura, creatures of your choice have Advantage on all saving throws, and other creatures have Disadvantage on attack rolls against them. In addition, when a Fiend or an Undead hits an affected creature with a melee attack roll, the attacker must succeed on a Constitution saving throw or have the Blinded condition until the end of its next turn.",https://www.dndbeyond.com/spells/2619155-holy-aura,Wards & Sanctuaries,Hard Ban,Primary,Hard Ban,Hard Ban,Hard Ban
8th,Mind Blank,Abjuration,1 Action,,,"V, S",,24 Hours,,,,Charmed,,"Until the spell ends, one willing creature you touch has Immunity to Psychic damage and the Charmed condition. The target is also unaffected by anything that would sense its emotions or alignment, read its thoughts, or magically detect its location, and no spell—not even Wish —can gather information about the target, observe it remotely, or control its mind.",https://www.dndbeyond.com/spells/2619036-mind-blank,Wards & Sanctuaries,Hard Ban,Primary,Hard Ban,Hard Ban,Hard Ban
8th,Power Word Stun,Enchantment,1 Action,60 ft.,,V,,Instantaneous,,,,Stunned,,"You overwhelm the mind of one creature you can see within range. If the target has 150 Hit Points or fewer, it has the Stunned condition. Otherwise, its Speed is 0 until the start of your next turn.

The Stunned target makes a Constitution saving throw at the end of each of its turns, ending the condition on itself on a success.",https://www.dndbeyond.com/spells/2618889-power-word-stun,Conditions & Debuffs,Hard Ban,Primary,Hard Ban,Hard Ban,Secondary
8th,Sunburst,Evocation,1 Action,150 ft.,(60 ft. ),"V, S, M",,Instantaneous,,,CON Save,Radiant,,"Brilliant sunlight flashes in a 60-foot-radius Sphere centered on a point you choose within range. Each creature in the Sphere makes a Constitution saving throw. On a failed save, a creature takes 12d6 Radiant damage and has the Blinded condition for 1 minute. On a successful save, it takes half as much damage only.

A creature Blinded by this spell makes another Constitution saving throw at the end of each of its turns, ending the effect on itself on a success.

This spell dispels Darkness in its area that was created by any spell.",https://www.dndbeyond.com/spells/2619123-sunburst,Conditions & Debuffs,Hard Ban,Primary,Hard Ban,Hard Ban,Secondary
