Level,Name,School,Casting Time,Range,Area,Components,Materials,Duration,Concentration,Ritual,Attack/Save,Damage/Effect,Source,Description,URL_absolute,Primary Effect Category,Arcane Status,Divine Status,Nature Status,Elemental Status,Psionics Status
1st,Alarm,Abjuration,1 Minute,30 ft.,(20 ft. ),"V, S, M",,8 Hours,,,,Detection,,"You set an alarm against intrusion. Choose a door, a window, or an area within range that is no larger than a 20-foot Cube. Until the spell ends, an alarm alerts you whenever a creature touches or enters the warded area. When you cast the spell, you can designate creatures that won’t set off the alarm. You also choose whether the alarm is audible or mental:

Audible Alarm. The alarm produces the sound of a handbell for 10 seconds within 60 feet of the warded area.

Mental Alarm. You are alerted by a mental ping if you are within 1 mile of the warded area. This ping awakens you if you’re asleep.",https://www.dndbeyond.com/spells/2619222-alarm,Wards & Sanctuaries,Hard Ban,Primary,Hard Ban,Hard Ban,Hard Ban
1st,Armor of Agathys,Abjuration,1 Bonus Action,,,"V, S, M",,1 Hour,,,,Cold,,"Protective magical frost surrounds you. You gain 5 Temporary Hit Points . If a creature hits you with a melee attack roll before the spell ends, the creature takes 5 Cold damage. The spell ends early if you have no Temporary Hit Points.

Using a Higher-Level Spell Slot. The Temporary Hit Points and the Cold damage both increase by 5 for each spell slot level above 1.",https://www.dndbeyond.com/spells/2618870-armor-of-agathys,Wards & Sanctuaries,Hard Ban,Primary,Hard Ban,Hard Ban,Hard Ban
1st,Bane,Enchantment,1 Action,30 ft.,,"V, S, M",,1 Minute,,,CHA Save,Debuff,,"Up to three creatures of your choice that you can see within range must each make a Charisma saving throw. Whenever a target that fails this save makes an attack roll or a saving throw before the spell ends, the target must subtract 1d4 from the attack roll or save.

Using a Higher-Level Spell Slot. You can target one additional creature for each spell slot level above 1.",https://www.dndbeyond.com/spells/2618900-bane,Conditions & Debuffs,Hard Ban,Primary,Hard Ban,Hard Ban,Secondary
1st,Bless,Enchantment,1 Action,30 ft.,,"V, S, M",,1 Minute,,,,Buff,,"You bless up to three creatures within range. Whenever a target makes an attack roll or a saving throw before the spell ends, the target adds 1d4 to the attack roll or save.

Using a Higher-Level Spell Slot. You can target one additional creature for each spell slot level above 1.",https://www.dndbeyond.com/spells/2618933-bless,Conditions & Debuffs,Hard Ban,Primary,Hard Ban,Hard Ban,Secondary
1st,Command,Enchantment,1 Action,60 ft.,,V,,Instantaneous,,,WIS Save,Prone,,"You speak a one-word command to a creature you can see within range. The target must succeed on a Wisdom saving throw or follow the command on its next turn. Choose the command from these options:

Approach. The target moves toward you by the shortest and most direct route, ending its turn if it moves within 5 feet of you.

Drop. The target drops whatever it is holding and then ends its turn.

Flee. The target spends its turn moving away from you by the fastest available means.

Grovel. The target has the Prone condition and then ends its turn.

Halt. On its turn, the target doesn’t move and takes no action or Bonus Action.

Using a Higher-Level Spell Slot. You can affect one additional creature for each spell slot level above 1.",https://www.dndbeyond.com/spells/2618985-command,Conditions & Debuffs,Hard Ban,Primary,Hard Ban,Hard Ban,Secondary
1st,Compelled Duel,Enchantment,1 Bonus Action,30 ft.,,V,,1 Minute,,,WIS Save,Control (...),,"You try to compel a creature into a duel. One creature that you can see within range makes a Wisdom saving throw. On a failed save, the target has Disadvantage on attack rolls against creatures other than you, and it can’t willingly move to a space that is more than 30 feet away from you.

The spell ends if you make an attack roll against a creature other than the target, if you cast a spell on an enemy other than the target, if an ally of yours damages the target, or if you end your turn more than 30 feet away from the target.",https://www.dndbeyond.com/spells/2618990-compelled-duel,Conditions & Debuffs,Hard Ban,Primary,Hard Ban,Hard Ban,Secondary
1st,Comprehend Languages,Divination,1 Action,,,"V, S, M",,1 Hour,,,,Social,,"For the duration, you understand the literal meaning of any language that you hear or see signed. You also understand any written language that you see, but you must be touching the surface on which the words are written. It takes about 1 minute to read one page of text. This spell doesn’t decode symbols or secret messages.",https://www.dndbeyond.com/spells/2618993-comprehend-languages,Communication & Language,Hard Ban,Secondary,Hard Ban,Hard Ban,Exclusive
1st,Cure Wounds,Abjuration,1 Action,,,"V, S",,Instantaneous,,,,Healing,,"A creature you touch regains a number of Hit Points equal to 2d8 plus your spellcasting ability modifier.

Using a Higher-Level Spell Slot. The healing increases by 2d8 for each spell slot level above 1.",https://www.dndbeyond.com/spells/2619079-cure-wounds,Healing & Restoration,Hard Ban,Primary,Hard Ban,Primary,Hard Ban
1st,Divine Favor,Transmutation,1 Bonus Action,,,"V, S",,1 Minute,,,,Radiant,,"Until the spell ends, your attacks with weapons deal an extra 1d4 Radiant damage on a hit.",https://www.dndbeyond.com/spells/2619142-divine-favor,Conditions & Debuffs,Hard Ban,Primary,Hard Ban,Hard Ban,Secondary
1st,Find Familiar,Conjuration,1 Hour,10 ft.,,"V, S, M",,Instantaneous,,,,Summoning,,"You gain the service of a familiar, a spirit that takes an animal form you choose: Bat , Cat , Frog , Hawk , Lizard , Octopus , Owl , Rat , Raven , Spider , Weasel , or another Beast that has a Challenge Rating of 0 . Appearing in an unoccupied space within range, the familiar has the statistics of the chosen form, though it is a Celestial, Fey, or Fiend (your choice) instead of a Beast. Your familiar acts independently of you, but it obeys your commands.

Telepathic Connection. While your familiar is within 100 feet of you, you can communicate with it telepathically. Additionally, as a Bonus Action, you can see through the familiar’s eyes and hear what it hears until the start of your next turn, gaining the benefits of any special senses it has.

Finally, when you cast a spell with a range of touch, your familiar can deliver the touch. Your familiar must be within 100 feet of you, and it must take a Reaction to deliver the touch when you cast the spell.

Combat. The familiar is an ally to you and your allies. It rolls its own Initiative and acts on its own turn. A familiar can’t attack, but it can take other actions as normal.

Disappearance of the Familiar. When the familiar drops to 0 Hit Points, it disappears. It reappears after you cast this spell again. As a Magic action, you can temporarily dismiss the familiar to a pocket dimension. Alternatively, you can dismiss it forever. As a Magic action while it is temporarily dismissed, you can cause it to reappear in an unoccupied space within 30 feet of you. Whenever the familiar drops to 0 Hit Points or disappears into the pocket dimension, it leaves behind in its space anything it was wearing or carrying.

One Familiar Only. You can’t have more than one familiar at a time. If you cast this spell while you have a familiar, you instead cause it to adopt a new eligible form.",https://www.dndbeyond.com/spells/2618877-find-familiar,Summoning — Extraplanar,Hard Ban,Secondary,Hard Ban,Hard Ban,Hard Ban
1st,Healing Word,Abjuration,1 Bonus Action,60 ft.,,V,,Instantaneous,,,,Healing,,"A creature of your choice that you can see within range regains Hit Points equal to 2d4 plus your spellcasting ability modifier.

Using a Higher-Level Spell Slot. The healing increases by 2d4 for each spell slot level above 1.",https://www.dndbeyond.com/spells/2619143-healing-word,Healing & Restoration,Hard Ban,Primary,Hard Ban,Primary,Hard Ban
1st,Heroism,Enchantment,1 Action,,,"V, S",,1 Minute,,,,Frightened,,"A willing creature you touch is imbued with bravery. Until the spell ends, the creature is immune to the Frightened condition and gains Temporary Hit Points equal to your spellcasting ability modifier at the start of each of its turns.

Using a Higher-Level Spell Slot. You can target one additional creature for each spell slot level above 1.",https://www.dndbeyond.com/spells/2619151-heroism,Conditions & Debuffs,Hard Ban,Primary,Hard Ban,Hard Ban,Secondary
1st,Hex,Enchantment,1 Bonus Action,90 ft.,,"V, S, M",,1 Hour,,,,Necrotic,,"You place a curse on a creature that you can see within range. Until the spell ends, you deal an extra 1d6 Necrotic damage to the target whenever you hit it with an attack roll. Also, choose one ability when you cast the spell. The target has Disadvantage on ability checks made with the chosen ability.

If the target drops to 0 Hit Points before this spell ends, you can take a Bonus Action on a later turn to curse a new creature.

Using a Higher-Level Spell Slot. Your Concentration can last longer with a spell slot of level 2 (up to 4 hours), 3–4 (up to 8 hours), or 5+ (24 hours).",https://www.dndbeyond.com/spells/2618988-hex,Curses & Hexes,Hard Ban,Primary,Hard Ban,Hard Ban,Hard Ban
1st,Hunter's Mark,Divination,1 Bonus Action,90 ft.,,V,,1 Hour,,,,Force,,"You magically mark one creature you can see within range as your quarry. Until the spell ends, you deal an extra 1d6 Force damage to the target whenever you hit it with an attack roll. You also have Advantage on any Wisdom ( Perception or Survival ) check you make to find it.

If the target drops to 0 Hit Points before this spell ends, you can take a Bonus Action to move the mark to a new creature you can see within range.

Using a Higher-Level Spell Slot. Your Concentration can last longer with a spell slot of level 3–4 (up to 8 hours) or 5+ (up to 24 hours).",https://www.dndbeyond.com/spells/2619166-hunters-mark,Curses & Hexes,Hard Ban,Primary,Hard Ban,Hard Ban,Hard Ban
1st,Mage Armor,Abjuration,1 Action,,,"V, S, M",,8 Hours,,,,Buff (...),,"You touch a willing creature who isn’t wearing armor. Until the spell ends, the target’s base AC becomes 13 plus its Dexterity modifier. The spell ends early if the target dons armor.",https://www.dndbeyond.com/spells/2619006-mage-armor,Wards & Sanctuaries,Hard Ban,Primary,Hard Ban,Hard Ban,Hard Ban
1st,Protection from Evil and Good,Abjuration,1 Action,,,"V, S, M",,10 Minutes,,,,Buff (...),,"Until the spell ends, one willing creature you touch is protected against creatures that are Aberrations, Celestials, Elementals, Fey, Fiends, or Undead. The protection grants several benefits. Creatures of those types have Disadvantage on attack rolls against the target. The target also can’t be possessed by or gain the Charmed or Frightened conditions from them. If the target is already possessed, Charmed, or Frightened by such a creature, the target has Advantage on any new saving throw against the relevant effect.",https://www.dndbeyond.com/spells/2618912-protection-from-evil-and-good,Wards & Sanctuaries,Hard Ban,Primary,Hard Ban,Hard Ban,Hard Ban
1st,Sanctuary,Abjuration,1 Bonus Action,30 ft.,,"V, S, M",,1 Minute,,,WIS Save,Buff (...),,"You ward a creature within range. Until the spell ends, any creature who targets the warded creature with an attack roll or a damaging spell must succeed on a Wisdom saving throw or either choose a new target or lose the attack or spell. This spell doesn’t protect the warded creature from areas of effect.

The spell ends if the warded creature makes an attack roll, casts a spell, or deals damage.",https://www.dndbeyond.com/spells/2619003-sanctuary,Wards & Sanctuaries,Hard Ban,Primary,Hard Ban,Hard Ban,Hard Ban
1st,Shield of Faith,Abjuration,1 Bonus Action,60 ft.,,"V, S, M",,10 Minutes,,,,Buff (...),,"A shimmering field surrounds a creature of your choice within range, granting it a +2 bonus to AC for the duration.",https://www.dndbeyond.com/spells/2619020-shield-of-faith,Wards & Sanctuaries,Hard Ban,Primary,Hard Ban,Hard Ban,Hard Ban
1st,Tasha's Hideous Laughter,Enchantment,1 Action,30 ft.,,"V, S, M",,1 Minute,,,WIS Save,Prone (...),,"One creature of your choice that you can see within range makes a Wisdom saving throw. On a failed save, it has the Prone and Incapacitated conditions for the duration. During that time, it laughs uncontrollably if it’s capable of laughter, and it can’t end the Prone condition on itself.

At the end of each of its turns and each time it takes damage, it makes another Wisdom saving throw. The target has Advantage on the save if the save is triggered by damage. On a successful save, the spell ends.

Using a Higher-Level Spell Slot. You can target one additional creature for each spell slot level above 1.",https://www.dndbeyond.com/spells/2619132-tashas-hideous-laughter,Conditions & Debuffs,Hard Ban,Primary,Hard Ban,Hard Ban,Secondary
2nd,Aid,Abjuration,1 Action,30 ft.,,"V, S, M",,8 Hours,,,,Buff,,"Choose up to three creatures within range. Each target’s Hit Point maximum and current Hit Points increase by 5 for the duration.

Using a Higher-Level Spell Slot. Each target’s Hit Points increase by 5 for each spell slot level above 2.",https://www.dndbeyond.com/spells/2618845-aid,Wards & Sanctuaries,Hard Ban,Primary,Hard Ban,Hard Ban,Hard Ban
2nd,Air Bubble,Conjuration,1 Action,60 ft.,,S,,24 Hours,,,,Buff,,,https://www.dndbeyond.com/spells/1585025-air-bubble,Summoning — Extraplanar,Hard Ban,Secondary,Hard Ban,Hard Ban,Hard Ban
2nd,Arcane Vigor,Abjuration,1 Bonus Action,,,"V, S",,Instantaneous,,,,,,"You tap into your life force to heal yourself. Roll one or two of your unexpended Hit Point Dice, and regain a number of Hit Points equal to the roll’s total plus your spellcasting ability modifier. Those dice are then expended.

Using a Higher-Level Spell Slot. The number of unexpended Hit Dice you can roll increases by one for each spell slot level above 2.",https://www.dndbeyond.com/spells/2618831-arcane-vigor,Healing & Restoration,Hard Ban,Primary,Hard Ban,Primary,Hard Ban
2nd,Augury,Divination,1 Minute,,,"V, S, M",,Instantaneous,,,,Foreknowledge,,"You receive an omen from an otherworldly entity about the results of a course of action that you plan to take within the next 30 minutes. The DM chooses the omen from the Omens table.

The spell doesn’t account for circumstances, such as other spells, that might change the results.

If you cast the spell more than once before finishing a Long Rest, there is a cumulative 25 percent chance for each casting after the first that you get no answer.",https://www.dndbeyond.com/spells/2618882-augury,Divination — Omens & Revelation,Hard Ban,Exclusive,Hard Ban,Hard Ban,Hard Ban
2nd,Blindness/Deafness,Transmutation,1 Action,120 ft.,,V,,1 Minute,,,CON Save,Blinded (...),,"One creature that you can see within range must succeed on a Constitution saving throw, or it has the Blinded or Deafened condition (your choice) for the duration. At the end of each of its turns, the target repeats the save, ending the spell on itself on a success.

Using a Higher-Level Spell Slot. You can target one additional creature for each spell slot level above 2.",https://www.dndbeyond.com/spells/2618938-blindness-deafness,Conditions & Debuffs,Hard Ban,Primary,Hard Ban,Hard Ban,Secondary
2nd,Borrowed Knowledge,Divination,1 Action,,,"V, S, M",,1 Hour,,,,Utility,,,https://www.dndbeyond.com/spells/1239802-borrowed-knowledge,Divination — Omens & Revelation,Hard Ban,Exclusive,Hard Ban,Hard Ban,Hard Ban
2nd,Dust Devil,Conjuration,1 Action,60 ft.,(5 ft. *),"V, S, M",,1 Minute,,,STR Save,Bludgeoning,,"Choose an unoccupied 5-foot cube of air that you can see within range. An elemental force that resembles a dust devil appears in the cube and lasts for the spell’s duration.

Any creature that ends its turn within 5 feet of the dust devil must make a Strength saving throw. On a failed save, the creature takes 1d8 bludgeoning damage and is pushed 10 feet away. On a successful save, the creature takes half as much damage and isn’t pushed.

As a bonus action, you can move the dust devil up to 30 feet in any direction. If the dust devil moves over sand, dust, loose dirt, or small gravel, it sucks up the material and forms a 10-foot-radius cloud of debris around itself that lasts until the start of your next turn. The cloud heavily obscures its area.

At Higher Levels. When you cast this spell using a spell slot of 3rd level or higher, the damage increases by 1d8 for each slot level above 2nd.",https://www.dndbeyond.com/spells/2376-dust-devil,Summoning — Extraplanar,Hard Ban,Secondary,Hard Ban,Hard Ban,Hard Ban
2nd,Find Steed,Conjuration,1 Action,30 ft.,,"V, S",,Instantaneous,,,,Summoning,,"You summon an otherworldly being that appears as a loyal steed in an unoccupied space of your choice within range. This creature uses the Otherworldly Steed stat block. If you already have a steed from this spell, the steed is replaced by the new one.

The steed resembles a Large, rideable animal of your choice, such as a horse, a camel, a dire wolf, or an elk. Whenever you cast the spell, choose the steed’s creature type—Celestial, Fey, or Fiend—which determines certain traits in the stat block.

Combat. The steed is an ally to you and your allies. In combat, it shares your Initiative count, and it functions as a controlled mount while you ride it (as defined in the rules on mounted combat). If you have the Incapacitated condition, the steed takes its turn immediately after yours and acts independently, focusing on protecting you.

Disappearance of the Steed. The steed disappears if it drops to 0 Hit Points or if you die. When it disappears, it leaves behind anything it was wearing or carrying. If you cast this spell again, you decide whether you summon the steed that disappeared or a different one.

Using a Higher-Level Spell Slot. Use the spell slot’s level for the spell’s level in the stat block.

Large Celestial, Fey, or Fiend (Your Choice), Neutral

AC 10 + 1 per spell level

HP 5 + 10 per spell level (the steed has a number of Hit Dice [d10s] equal to the spell’s level)

Speed 60 ft., Fly 60 ft. (requires level 4+ spell)

Senses Passive Perception 11

Languages Telepathy 1 mile (works only with you)

CR None (XP 0; PB equals your Proficiency Bonus)

Traits

Life Bond. When you regain Hit Points from a level 1+ spell, the steed regains the same number of Hit Points if you’re within 5 feet of it.

Actions

Otherworldly Slam. Melee Attack Roll: Bonus equals your spell attack modifier, reach 5 ft. Hit: 1d8 plus the spell’s level of Radiant (Celestial), Psychic (Fey), or Necrotic (Fiend) damage.

Bonus Actions

Fell Glare (Fiend Only; Recharges after a Long Rest). Wisdom Saving Throw: DC equals your spell save DC, one creature within 60 feet the steed can see. Failure: The target has the Frightened condition until the end of your next turn.

Fey Step (Fey Only; Recharges after a Long Rest). The steed teleports, along with its rider, to an unoccupied space of your choice up to 60 feet away from itself.

Healing Touch (Celestial Only; Recharges after a Long Rest). One creature within 5 feet of the steed regains a number of Hit Points equal to 2d8 plus the spell’s level.",https://www.dndbeyond.com/spells/2618879-find-steed,Summoning — Extraplanar,Hard Ban,Secondary,Hard Ban,Hard Ban,Hard Ban
2nd,Gentle Repose,Necromancy,1 Action,,,"V, S, M",,10 Days,,,,Warding,,"You touch a corpse or other remains. For the duration, the target is protected from decay and can’t become Undead.

The spell also effectively extends the time limit on raising the target from the dead, since days spent under the influence of this spell don’t count against the time limit of spells such as Raise Dead .",https://www.dndbeyond.com/spells/2618942-gentle-repose,Resurrection,Hard Ban,Exclusive,Hard Ban,Hard Ban,Hard Ban
2nd,Healing Spirit,Conjuration,1 Bonus Action,60 ft.,(5 ft. ),"V, S",,1 Minute,,,,Healing (...),,"You call forth a nature spirit to soothe the wounded. The intangible spirit appears in a space that is a 5-foot cube you can see within range. The spirit looks like a transparent beast or fey (your choice).

Until the spell ends, whenever you or a creature you can see moves into the spirit’s space for the first time on a turn or starts its turn there, you can cause the spirit to restore 1d6 hit points to that creature (no action required). The spirit can’t heal constructs or undead. The spirit can heal a number of times equal to 1 + your spellcasting ability modifier (minimum of twice). After healing that number of times, the spirit disappears.

As a bonus action on your turn, you can move the spirit up to 30 feet to a space you can see.

At Higher Levels. When you cast this spell using a spell slot of 3rd level or higher, the healing increases by 1d6 for each slot level above 2nd.",https://www.dndbeyond.com/spells/14873-healing-spirit,Healing & Restoration,Hard Ban,Primary,Hard Ban,Primary,Hard Ban
2nd,Hold Person,Enchantment,1 Action,60 ft.,,"V, S, M",,1 Minute,,,WIS Save,Paralyzed,,"Choose a Humanoid that you can see within range. The target must succeed on a Wisdom saving throw or have the Paralyzed condition for the duration. At the end of each of its turns, the target repeats the save, ending the spell on itself on a success.

Using a Higher-Level Spell Slot. You can target one additional Humanoid for each spell slot level above 2.",https://www.dndbeyond.com/spells/2619153-hold-person,Conditions & Debuffs,Hard Ban,Primary,Hard Ban,Hard Ban,Secondary
2nd,Jim's Glowing Coin,Enchantment,1 Action,60 ft.,,"S, M, R",,1 Minute,,,WIS Save,,,"Of the many tactics employed by master magician and renowned adventurer Jim Darkmagic, the old glowing coin trick is a time-honored classic. When you cast the spell, you hurl the coin that is the spell’s material component to any spot within range. The coin lights up as if under the effect of a light spell. Each creature of your choice that you can see within 30 feet of the coin must succeed on a Wisdom saving throw or be distracted for the duration. While distracted, a creature has disadvantage on Wisdom ( Perception ) checks and initiative rolls.",https://www.dndbeyond.com/spells/188126-jims-glowing-coin,Conditions & Debuffs,Hard Ban,Primary,Hard Ban,Hard Ban,Secondary
2nd,Lesser Restoration,Abjuration,1 Bonus Action,,,"V, S",,Instantaneous,,,,Healing,,"You touch a creature and end one condition on it: Blinded , Deafened , Paralyzed , or Poisoned .",https://www.dndbeyond.com/spells/2619016-lesser-restoration,Healing & Restoration,Hard Ban,Primary,Hard Ban,Primary,Hard Ban
2nd,Pass without Trace,Abjuration,1 Action,,(30 ft. ),"V, S, M",,1 Hour,,,,Buff (...),,"You radiate a concealing aura in a 30-foot Emanation for the duration. While in the aura, you and each creature you choose have a +10 bonus to Dexterity ( Stealth ) checks and leave no tracks.",https://www.dndbeyond.com/spells/2618849-pass-without-trace,Conditions & Debuffs,Hard Ban,Primary,Hard Ban,Hard Ban,Secondary
2nd,Prayer of Healing,Abjuration,10 Minutes,30 ft.,,V,,Instantaneous,,,,Healing,,"Up to five creatures of your choice who remain within range for the spell’s entire casting gain the benefits of a Short Rest and also regain 2d8 Hit Points. A creature can’t be affected by this spell again until that creature finishes a Long Rest.

Using a Higher-Level Spell Slot. The healing increases by 1d8 for each spell slot level above 2.",https://www.dndbeyond.com/spells/2618892-prayer-of-healing,Wards & Sanctuaries,Hard Ban,Primary,Hard Ban,Hard Ban,Hard Ban
2nd,Protection from Poison,Abjuration,1 Action,,,"V, S",,1 Hour,,,,Buff (...),,"You touch a creature and end the Poisoned condition on it. For the duration, the target has Advantage on saving throws to avoid or end the Poisoned condition, and it has Resistance to Poison damage.",https://www.dndbeyond.com/spells/2618915-protection-from-poison,Healing & Restoration,Hard Ban,Primary,Hard Ban,Primary,Hard Ban
2nd,Pyrotechnics,Transmutation,1 Action,60 ft.,(5 ft. *),"V, S",,Instantaneous,,,CON Save,Blinded,,"Choose an area of nonmagical flame that you can see and that fits within a 5-foot cube within range. You can extinguish the fire in that area, and you create either fireworks or smoke when you do so.

Fireworks . The target explodes with a dazzling display of colors. Each creature within 10 feet of the target must succeed on a Constitution saving throw or become blinded until the end of your next turn.

Smoke. Thick black smoke spreads out from the target in a 20-foot radius, moving around corners. The area of the smoke is heavily obscured. The smoke persists for 1 minute or until a strong wind disperses it.",https://www.dndbeyond.com/spells/2396-pyrotechnics,Conditions & Debuffs,Hard Ban,Primary,Hard Ban,Hard Ban,Secondary
2nd,Ray of Enfeeblement,Necromancy,1 Action,60 ft.,,"V, S",,1 Minute,,,CON Save,Debuff,,"A beam of enervating energy shoots from you toward a creature within range. The target must make a Constitution saving throw. On a successful save, the target has Disadvantage on the next attack roll it makes until the start of your next turn.

On a failed save, the target has Disadvantage on Strength-based D20 Tests for the duration. During that time, it also subtracts 1d8 from all its damage rolls. The target repeats the save at the end of each of its turns, ending the spell on a success.",https://www.dndbeyond.com/spells/2618926-ray-of-enfeeblement,Conditions & Debuffs,Hard Ban,Primary,Hard Ban,Hard Ban,Secondary
