Level,Name,School,Casting Time,Range,Area,Components,Materials,Duration,Concentration,Ritual,Attack/Save,Damage/Effect,Source,Description,URL_absolute,Primary Effect Category,Arcane Status,Divine Status,Nature Status,Elemental Status,Psionics Status
3rd,Summon Undead,Necromancy,1 Action,90 ft.,,"V, S, M",,1 Hour,,,,Summoning,,"You call forth an Undead spirit. It manifests in an unoccupied space that you can see within range and uses the Undead Spirit stat block. When you cast the spell, choose the creature’s form: Ghostly, Putrid, or Skeletal. The spirit resembles an Undead creature with the chosen form, which determines certain details in its stat block. The creature disappears when it drops to 0 Hit Points or when the spell ends.

The creature is an ally to you and your allies. In combat, the creature shares your Initiative count, but it takes its turn immediately after yours. It obeys your verbal commands (no action required by you). If you don’t issue any, it takes the Dodge action and uses its movement to avoid danger.

Using a Higher-Level Spell Slot. Use the spell slot’s level for the spell’s level in the stat block.

Medium Undead, Neutral

AC 11 + the spell’s level

HP 30 (Ghostly and Putrid only) or 20 (Skeletal only) + 10 for each spell level above 3

Speed 30 ft.; Fly 40 ft. (hover; Ghostly only)

Immunities Necrotic, Poison; Exhaustion , Frightened , Paralyzed , Poisoned

Senses Darkvision 60 ft.; Passive Perception 10

Languages Understands the languages you know

CR None (XP 0; PB equals your Proficiency Bonus)

Traits

Festering Aura (Putrid Only). Constitution Saving Throw: DC equals your spell save DC, any creature (other than you) that starts its turn within a 5-foot Emanation originating from the spirit. Failure: The creature has the Poisoned condition until the start of its next turn.

Incorporeal Passage (Ghostly Only). The spirit can move through other creatures and objects as if they were Difficult Terrain . If it ends its turn inside an object, it is shunted to the nearest unoccupied space and takes 1d10 Force damage for every 5 feet traveled.

Actions

Multiattack. The spirit makes a number of attacks equal to half this spell’s level (round down).

Deathly Touch (Ghostly Only). Melee Attack Roll: Bonus equals your spell attack modifier, reach 5 ft. Hit: 1d8 + 3 + the spell’s level Necrotic damage, and the target has the Frightened condition until the end of its next turn.

Grave Bolt (Skeletal Only). Ranged Attack Roll: Bonus equals your spell attack modifier, range 150 ft. Hit: 2d4 + 3 + the spell’s level Necrotic damage.

Rotting Claw (Putrid Only). Melee Attack Roll: Bonus equals your spell attack modifier, reach 5 ft. Hit: 1d6 + 3 + the spell’s level Slashing damage. If the target has the Poisoned condition, it has the Paralyzed condition until the end of its next turn.",https://www.dndbeyond.com/spells/2619119-summon-undead,Summoning — Extraplanar,Hard Ban,Secondary,Hard Ban,Hard Ban,Hard Ban
3rd,Tongues,Divination,1 Action,,,"V, M",,1 Hour,,,,Communication (...),,"This spell grants the creature you touch the ability to understand any spoken or signed language that it hears or sees. Moreover, when the target communicates by speaking or signing, any creature that knows at least one language can understand it if that creature can hear the speech or see the signing.",https://www.dndbeyond.com/spells/2619190-tongues,Communication & Language,Hard Ban,Secondary,Hard Ban,Hard Ban,Exclusive
3rd,Vampiric Touch,Necromancy,1 Action,,,"V, S",,1 Minute,,,Melee,Necrotic,,"The touch of your shadow-wreathed hand can siphon life force from others to heal your wounds. Make a melee spell attack against one creature within reach. On a hit, the target takes 3d6 Necrotic damage, and you regain Hit Points equal to half the amount of Necrotic damage dealt.

Until the spell ends, you can make the attack again on each of your turns as a Magic action, targeting the same creature or a different one.

Using a Higher-Level Spell Slot. The damage increases by 1d6 for each spell slot level above 3.",https://www.dndbeyond.com/spells/2619214-vampiric-touch,Healing & Restoration,Hard Ban,Primary,Hard Ban,Primary,Hard Ban
4th,Aura of Life,Abjuration,1 Action,,(30 ft. ),V,,10 Minutes,,,,Healing (...),,"An aura radiates from you in a 30-foot Emanation for the duration. While in the aura, you and your allies have Resistance to Necrotic damage, and your Hit Point maximums can’t be reduced. If an ally with 0 Hit Points starts its turn in the aura, that ally regains 1 Hit Point.",https://www.dndbeyond.com/spells/2618884-aura-of-life,Healing & Restoration,Hard Ban,Primary,Hard Ban,Primary,Hard Ban
4th,Aura of Purity,Abjuration,1 Action,,(30 ft. ),V,,10 Minutes,,,,Buff (...),,"An aura radiates from you in a 30-foot Emanation for the duration. While in the aura, you and your allies have Resistance to Poison damage and Advantage on saving throws to avoid or end effects that include the Blinded , Charmed , Deafened , Frightened , Paralyzed , Poisoned , or Stunned condition.",https://www.dndbeyond.com/spells/2618888-aura-of-purity,Conditions & Debuffs,Hard Ban,Primary,Hard Ban,Hard Ban,Secondary
4th,Banishment,Abjuration,1 Action,30 ft.,,"V, S, M",,1 Minute,,,CHA Save,Banishment (...),,"One creature that you can see within range must succeed on a Charisma saving throw or be transported to a harmless demiplane for the duration. While there, the target has the Incapacitated condition. When the spell ends, the target reappears in the space it left or in the nearest unoccupied space if that space is occupied.

If the target is an Aberration, a Celestial, an Elemental, a Fey, or a Fiend, the target doesn’t return if the spell lasts for 1 minute. The target is instead transported to a random location on a plane (DM’s choice) associated with its creature type.

Using a Higher-Level Spell Slot. You can target one additional creature for each spell slot level above 4.",https://www.dndbeyond.com/spells/2618906-banishment,Summoning — Extraplanar,Hard Ban,Secondary,Hard Ban,Hard Ban,Hard Ban
4th,Death Ward,Abjuration,1 Action,,,"V, S",,8 Hours,,,,Buff (...),,"You touch a creature and grant it a measure of protection from death. The first time the target would drop to 0 Hit Points before the spell ends, the target instead drops to 1 Hit Point, and the spell ends.

If the spell is still in effect when the target is subjected to an effect that would kill it instantly without dealing damage, that effect is negated against the target, and the spell ends.",https://www.dndbeyond.com/spells/2619085-death-ward,Wards & Sanctuaries,Hard Ban,Primary,Hard Ban,Hard Ban,Hard Ban
4th,Divination,Divination,1 Action,,,"V, S, M",,Instantaneous,,,,Foreknowledge,,"This spell puts you in contact with a god or a god’s servants. You ask one question about a specific goal, event, or activity to occur within 7 days. The DM offers a truthful reply, which might be a short phrase or cryptic rhyme. The spell doesn’t account for circumstances that might change the answer, such as the casting of other spells.

If you cast the spell more than once before finishing a Long Rest, there is a cumulative 25 percent chance for each casting after the first that you get no answer.",https://www.dndbeyond.com/spells/2619140-divination,Divination — Omens & Revelation,Hard Ban,Exclusive,Hard Ban,Hard Ban,Hard Ban
4th,Elemental Bane,Transmutation,1 Action,90 ft.,,"V, S",,1 Minute,,,CON Save,Acid (...),,"Choose one creature you can see within range, and choose one of the following damage types: acid, cold, fire, lightning, or thunder. The target must succeed on a Constitution saving throw or be affected by the spell for its duration. The first time each turn the affected target takes damage of the chosen type, the target takes an extra 2d6 damage of that type. Moreover, the target loses any resistance to that damage type until the spell ends.

At Higher Levels. When you cast this spell using a spell slot of 5th level or higher, you can target one additional creature for each slot level above 4th. The creatures must be within 30 feet of each other when you target them.",https://www.dndbeyond.com/spells/2379-elemental-bane,Curses & Hexes,Hard Ban,Primary,Hard Ban,Hard Ban,Hard Ban
4th,Evard's Black Tentacles,Conjuration,1 Action,90 ft.,(20 ft. ),"V, S, M",,1 Minute,,,STR Save,Bludgeoning,,"Squirming, ebony tentacles fill a 20-foot square on ground that you can see within range. For the duration, these tentacles turn the ground in that area into Difficult Terrain .

Each creature in that area makes a Strength saving throw. On a failed save, it takes 3d6 Bludgeoning damage, and it has the Restrained condition until the spell ends. A creature also makes that save if it enters the area or ends it turn there. A creature makes that save only once per turn.

A Restrained creature can take an action to make a Strength ( Athletics ) check against your spell save DC, ending the condition on itself on a success.",https://www.dndbeyond.com/spells/2619187-evards-black-tentacles,Conditions & Debuffs,Hard Ban,Primary,Hard Ban,Hard Ban,Secondary
4th,Find Greater Steed,Conjuration,10 Minutes,30 ft.,,"V, S",,Instantaneous,,,,Summoning,,"You summon a spirit that assumes the form of a loyal, majestic mount. Appearing in an unoccupied space within range, the spirit takes on a form you choose: a griffon , a pegasus , a peryton , a dire wolf , a rhinoceros , or a saber-toothed tiger . The creature has the statistics provided in the Monster Manual for the chosen form, though it is a celestial, a fey, or a fiend (your choice) instead of its normal creature type. Additionally, if it has an Intelligence score of 5 or lower, its Intelligence becomes 6, and it gains the ability to understand one language of your choice that you speak.

You control the mount in combat. While the mount is within 1 mile of you, you can communicate with it telepathically. While mounted on it, you can make any spell you cast that targets only you also target the mount.

The mount disappears temporarily when it drops to 0 hit points or when you dismiss it as an action. Casting this spell again re-summons the bonded mount, with all its hit points restored and any conditions removed.

You can’t have more than one mount bonded by this spell or find steed at the same time. As an action, you can release a mount from its bond, causing it to disappear permanently.

Whenever the mount disappears, it leaves behind any objects it was wearing or carrying.",https://www.dndbeyond.com/spells/14871-find-greater-steed,Summoning — Extraplanar,Hard Ban,Secondary,Hard Ban,Hard Ban,Hard Ban
4th,Fire Shield,Evocation,1 Action,,,"V, S, M",,10 Minutes,,,,Fire (...),,"Wispy flames wreathe your body for the duration, shedding Bright Light in a 10-foot radius and Dim Light for an additional 10 feet.

The flames provide you with a warm shield or a chill shield, as you choose. The warm shield grants you Resistance to Cold damage, and the chill shield grants you Resistance to Fire damage.

In addition, whenever a creature within 5 feet of you hits you with a melee attack roll, the shield erupts with flame. The attacker takes 2d8 Fire damage from a warm shield or 2d8 Cold damage from a chill shield.",https://www.dndbeyond.com/spells/2618894-fire-shield,Wards & Sanctuaries,Hard Ban,Primary,Hard Ban,Hard Ban,Hard Ban
4th,Fount of Moonlight,Evocation,1 Action,,,"V, S",,10 Minutes,,,CON Save,Radiant,,"A cool light wreathes your body for the duration, emitting Bright Light in a 20-foot radius and Dim Light for an additional 20 feet.

Until the spell ends, you have Resistance to Radiant damage, and your melee attacks deal an extra 2d6 Radiant damage on a hit.

In addition, immediately after you take damage from a creature you can see within 60 feet of yourself, you can take a Reaction to force the creature to make a Constitution saving throw. On a failed save, the creature has the Blinded condition until the end of your next turn.",https://www.dndbeyond.com/spells/2618835-fount-of-moonlight,Conditions & Debuffs,Hard Ban,Primary,Hard Ban,Hard Ban,Secondary
4th,Freedom of Movement,Abjuration,1 Action,,,"V, S, M",,1 Hour,,,,Buff (...),,"You touch a willing creature. For the duration, the target’s movement is unaffected by Difficult Terrain , and spells and other magical effects can neither reduce the target’s Speed nor cause the target to have the Paralyzed or Restrained conditions. The target also has a Swim Speed equal to its Speed.

In addition, the target can spend 5 feet of movement to automatically escape from nonmagical restraints, such as manacles or a creature imposing the Grappled condition on it.

Using a Higher-Level Spell Slot. You can target one additional creature for each spell slot level above 4.",https://www.dndbeyond.com/spells/2618921-freedom-of-movement,Conditions & Debuffs,Hard Ban,Primary,Hard Ban,Hard Ban,Secondary
4th,Gate Seal,Abjuration,1 Minute,60 ft.,(30 ft. ),"V, S, M",,24 Hours,,,,Control (...),,,https://www.dndbeyond.com/spells/2119578-gate-seal,Wards & Sanctuaries,Hard Ban,Primary,Hard Ban,Hard Ban,Hard Ban
4th,Giant Insect,Conjuration,1 Action,60 ft.,,"V, S",,10 Minutes,,,,Summoning,,"You summon a giant centipede, spider, or wasp (chosen when you cast the spell). It manifests in an unoccupied space you can see within range and uses the Giant Insect stat block. The form you choose determines certain details in its stat block. The creature disappears when it drops to 0 Hit Points or when the spell ends.

The creature is an ally to you and your allies. In combat, the creature shares your Initiative count, but it takes its turn immediately after yours. It obeys your verbal commands (no action required by you). If you don’t issue any, it takes the Dodge action and uses its movement to avoid danger.

Using a Higher-Level Spell Slot. Use the spell slot’s level for the spell’s level in the stat block.

Large Beast, Unaligned

AC 11 + the spell’s level

HP 30 + 10 for each spell level above 4

Speed 40 ft., Climb 40 ft., Fly 40 ft. (Wasp only)

Senses Darkvision 60 ft., Passive Perception 12

Languages Understands the languages you know

CR None (XP 0; PB equals your Proficiency Bonus)

Traits

Spider Climb. The insect can climb difficult surfaces, including along ceilings, without needing to make an ability check.

Actions

Multiattack. The insect makes a number of attacks equal to half this spell’s level (round down).

Poison Jab. Melee Attack Roll: Bonus equals your spell attack modifier, reach 10 ft. Hit: 1d6 + 3 plus the spell’s level Piercing damage plus 1d4 Poison damage.

Web Bolt (Spider Only). Ranged Attack Roll: Bonus equals your spell attack modifier, range 60 ft. Hit: 1d10 + 3 plus the spell’s level Bludgeoning damage, and the target’s Speed is reduced to 0 until the start of the insect’s next turn.

Bonus Actions

Venomous Spew (Centipede Only). Constitution Saving Throw: Your spell save DC, one creature the insect can see within 10 feet. Failure: The target has the Poisoned condition until the start of the insect’s next turn.",https://www.dndbeyond.com/spells/2618944-giant-insect,Conditions & Debuffs,Hard Ban,Primary,Hard Ban,Hard Ban,Secondary
4th,Guardian of Faith,Conjuration,1 Action,30 ft.,,V,,8 Hours,,,DEX Save,Radiant,,"A Large spectral guardian appears and hovers for the duration in an unoccupied space that you can see within range. The guardian occupies that space and is invulnerable, and it appears in a form appropriate for your deity or pantheon.

Any enemy that moves to a space within 10 feet of the guardian for the first time on a turn or starts its turn there makes a Dexterity saving throw, taking 20 Radiant damage on a failed save or half as much damage on a successful one. The guardian vanishes when it has dealt a total of 60 damage.",https://www.dndbeyond.com/spells/2619135-guardian-of-faith,Summoning — Extraplanar,Hard Ban,Secondary,Hard Ban,Hard Ban,Hard Ban
4th,Leomund's Secret Chest,Conjuration,1 Action,,,"V, S, M",,Until Dispelled,,,,Utility,,"You hide a chest and all its contents on the Ethereal Plane. You must touch the chest and the miniature replica that serve as Material components for the spell. The chest can contain up to 12 cubic feet of nonliving material (3 feet by 2 feet by 2 feet).

While the chest remains on the Ethereal Plane, you can take a Magic action and touch the replica to recall the chest. It appears in an unoccupied space on the ground within 5 feet of you. You can send the chest back to the Ethereal Plane by taking a Magic action to touch the chest and the replica.

After 60 days, there is a cumulative 5 percent chance at the end of each day that the spell ends. The spell also ends if you cast this spell again or if the Tiny replica chest is destroyed. If the spell ends and the larger chest is on the Ethereal Plane, the chest remains there for you or someone else to find.",https://www.dndbeyond.com/spells/2619012-leomunds-secret-chest,Summoning — Extraplanar,Hard Ban,Secondary,Hard Ban,Hard Ban,Hard Ban
4th,Mordenkainen's Faithful Hound,Conjuration,1 Action,30 ft.,,"V, S, M",,8 Hours,,,DEX Save,Force,,"You conjure a phantom watchdog in an unoccupied space that you can see within range. The hound remains for the duration or until the two of you are more than 300 feet apart from each other.

No one but you can see the hound, and it is intangible and invulnerable. When a Small or larger creature comes within 30 feet of it without first speaking the password that you specify when you cast this spell, the hound starts barking loudly. The hound has Truesight with a range of 30 feet.

At the start of each of your turns, the hound attempts to bite one enemy within 5 feet of it. That enemy must succeed on a Dexterity saving throw or take 4d8 Force damage.

On your later turns, you can take a Magic action to move the hound up to 30 feet.",https://www.dndbeyond.com/spells/2619110-mordenkainens-faithful-hound,Summoning — Extraplanar,Hard Ban,Secondary,Hard Ban,Hard Ban,Hard Ban
4th,Otiluke's Resilient Sphere,Abjuration,1 Action,30 ft.,,"V, S, M",,1 Minute,,,DEX Save,Control (...),,"A shimmering sphere encloses a Large or smaller creature or object within range. An unwilling creature must succeed on a Dexterity saving throw or be enclosed for the duration.

Nothing—not physical objects, energy, or other spell effects—can pass through the barrier, in or out, though a creature in the sphere can breathe there. The sphere is immune to all damage, and a creature or object inside can’t be damaged by attacks or effects originating from outside, nor can a creature inside the sphere damage anything outside it.

The sphere is weightless and just large enough to contain the creature or object inside. An enclosed creature can take an action to push against the sphere’s walls and thus roll the sphere at up to half the creature’s Speed. Similarly, the globe can be picked up and moved by other creatures.

A Disintegrate spell targeting the globe destroys it without harming anything inside.",https://www.dndbeyond.com/spells/2619128-otilukes-resilient-sphere,Wards & Sanctuaries,Hard Ban,Primary,Hard Ban,Hard Ban,Hard Ban
4th,Spirit of Death,Necromancy,1 Action,60 ft.,,"V, S, M",,1 Hour,,,,Summoning,,"You call forth a spirit that embodies death. The spirit manifests in an unoccupied space you can see within range and uses the reaper spirit stat block. The spirit disappears when it is reduced to 0 hit points or when the spell ends.

The spirit is an ally to you and your companions. In combat, the spirit shares your initiative count and takes its turn immediately after yours. It obeys your verbal commands (no action required by you). If you don’t issue the spirit any commands, it takes the Dodge action and uses its movement to avoid danger.

Medium Undead, Neutral

Armor Class 11 + the level of the spell (natural armor)

Hit Points 40 + 10 for each spell level above 4th

Speed 30 ft., fly 30 ft. (hover)

STR

16 (+3)

DEX

16 (+3)

CON

16 (+3)

INT

16 (+3)

WIS

16 (+3)

CHA

16 (+3)

Damage Immunities necrotic, poison

Condition Immunities charmed , exhaustion , frightened , paralyzed , poisoned

Senses darkvision 60 ft., passive Perception 13

Languages understands the languages you speak

Challenge — Proficiency Bonus equals your bonus

Incorporeal Movement. The spirit can move through other creatures and objects as if they were difficult terrain . If it ends its turn inside an object, it is shunted to the nearest unoccupied space and takes 1d10 force damage for every 5 feet shunted.

Actions

Multiattack. The spirit makes a number of Reaping Scythe attacks equal to half the level of the spell (rounded down).

Reaping Scythe. Melee Weapon Attack: your spell attack modifier to hit (with advantage), reach 5 ft., the creature haunted by Haunt Creature. Hit: 1d8 + 3 + the spell’s level necrotic damage.

Bonus Actions

Haunt Creature. The spirit targets a creature it can see within 10 feet of itself and begins haunting it. While the target is haunted, you and the spirit sense the direction and distance to the target if it is on the same plane of existence as you. Additionally, if the target starts its turn within 10 feet of the spirit, the target must succeed on a Wisdom saving throw against your spell save DC or have the frightened condition until the start of the target’s next turn. The target remains haunted until it dies, the spirit disappears, or the spirit uses this action again.

At Higher Levels. When you cast this spell using a spell slot of 5th level or higher, use the higher level wherever the spell’s level appears in the reaper spirit stat block.",https://www.dndbeyond.com/spells/2158657-spirit-of-death,Summoning — Extraplanar,Hard Ban,Secondary,Hard Ban,Hard Ban,Hard Ban
4th,Staggering Smite,Enchantment,1 Bonus Action *,,,V,,Instantaneous,,,WIS Save,Psychic,,"The target takes an extra 4d6 Psychic damage from the attack, and the target must succeed on a Wisdom saving throw or have the Stunned condition until the end of your next turn.

Using a Higher-Level Spell Slot. The extra damage increases by 1d6 for each spell slot level above 4.",https://www.dndbeyond.com/spells/2619084-staggering-smite,Conditions & Debuffs,Hard Ban,Primary,Hard Ban,Hard Ban,Secondary
4th,Summon Aberration,Conjuration,1 Action,90 ft.,,"V, S, M",,1 Hour,,,,Summoning,,"You call forth an aberrant spirit. It manifests in an unoccupied space that you can see within range and uses the Aberrant Spirit stat block. When you cast the spell, choose Beholderkin, Mind Flayer, or Slaad. The creature resembles an Aberration of that kind, which determines certain details in its stat block. The creature disappears when it drops to 0 Hit Points or when the spell ends.

The creature is an ally to you and your allies. In combat, it shares your Initiative count, but it takes its turn immediately after yours. It obeys your verbal commands (no action required by you). If you don’t issue any, it takes the Dodge action and uses its movement to avoid danger.

Using a Higher-Level Spell Slot. Use the spell slot’s level for the spell’s level in the stat block.

Medium Aberration, Neutral

AC 11 + the spell’s level

HP 40 + 10 for each spell level above 4

Speed 30 ft.; Fly 30 ft. (hover; Beholderkin only)

Immunities Psychic

Senses Darkvision 60 ft.; Passive Perception 10

Languages Deep Speech, understands the languages you know

CR None (XP 0; PB equals your Proficiency Bonus)

Traits

Regeneration (Slaad Only). The spirit regains 5 Hit Points at the start of its turn if it has at least 1 Hit Point.

Whispering Aura (Mind Flayer Only). At the start of each of the spirit’s turns, the spirit emits psionic energy if it doesn’t have the Incapacitated condition. Wisdom Saving Throw: DC equals your spell save DC, each creature (other than you) within 5 feet of the spirit. Failure: 2d6 Psychic damage.

Actions

Multiattack. The spirit makes a number of attacks equal to half this spell’s level (round down).

Claw (Slaad Only). Melee Attack Roll: Bonus equals your spell attack modifier, reach 5 ft. Hit: 1d10 + 3 + the spell’s level Slashing damage, and the target can’t regain Hit Points until the start of the spirit’s next turn.

Eye Ray (Beholderkin Only). Ranged Attack Roll: Bonus equals your spell attack modifier, range 150 ft. Hit: 1d8 + 3 + the spell’s level Psychic damage.

Psychic Slam (Mind Flayer Only). Melee Attack Roll: Bonus equals your spell attack modifier, reach 5 ft. Hit: 1d8 + 3 + the spell’s level Psychic damage.",https://www.dndbeyond.com/spells/2619105-summon-aberration,Summoning — Extraplanar,Hard Ban,Secondary,Hard Ban,Hard Ban,Hard Ban
