Level,Name,School,Casting Time,Range,Area,Components,Materials,Duration,Concentration,Ritual,Attack/Save,Damage/Effect,Source,Description,URL_absolute,Primary Effect Category,Arcane Status,Divine Status,Nature Status,Elemental Status,Psionics Status
2nd,Spray of Cards,Conjuration,1 Action,,(15 ft. ),"V, S, M",,Instantaneous,,,DEX Save,Force,,"You spray a 15-foot cone of spectral cards. Each creature in that area must make a Dexterity saving throw. On a failed save, a creature takes 2d10 force damage and has the blinded condition until the end of its next turn. On a successful save, a creature takes half as much damage only.

At Higher Levels. When you cast this spell using a spell slot of 3rd level or higher, the damage increases by 1d10 for each slot level above 2nd.",https://www.dndbeyond.com/spells/2158658-spray-of-cards,Conditions & Debuffs,Hard Ban,Primary,Hard Ban,Hard Ban,Secondary
2nd,Warding Bond,Abjuration,1 Action,,,"V, S, M",,1 Hour,,,,Buff (...),,"You touch another creature that is willing and create a mystic connection between you and the target until the spell ends. While the target is within 60 feet of you, it gains a +1 bonus to AC and saving throws, and it has Resistance to all damage. Also, each time it takes damage, you take the same amount of damage.

The spell ends if you drop to 0 Hit Points or if you and the target become separated by more than 60 feet. It also ends if the spell is cast again on either of the connected creatures.",https://www.dndbeyond.com/spells/2619203-warding-bond,Wards & Sanctuaries,Hard Ban,Primary,Hard Ban,Hard Ban,Hard Ban
3rd,Antagonize,Enchantment,1 Action,30 ft.,,"V, S, M",,Instantaneous,,,WIS Save,Psychic,,"You whisper magical words that antagonize one creature of your choice within range. The target must make a Wisdom saving throw. On a failed save, the target takes 4d4 psychic damage and must immediately use its reaction to make a melee attack against another creature of your choice that you can see. If the target can’t make this attack (for example, because there is no one within its reach or because its reaction is unavailable), the target instead has disadvantage on the next attack roll it makes before the start of your next turn. On a successful save, the target takes half as much damage only.

At Higher Levels. When you cast this spell using a spell slot of 4th level or higher, the damage increases by 1d4 for each slot level above 3rd.",https://www.dndbeyond.com/spells/2158656-antagonize,Conditions & Debuffs,Hard Ban,Primary,Hard Ban,Hard Ban,Secondary
3rd,Aura of Vitality,Abjuration,1 Action,,(30 ft. ),V,,1 Minute,,,,Healing,,"An aura radiates from you in a 30-foot Emanation for the duration. When you create the aura and at the start of each of your turns while it persists, you can restore 2d6 Hit Points to one creature in it.",https://www.dndbeyond.com/spells/2618891-aura-of-vitality,Healing & Restoration,Hard Ban,Primary,Hard Ban,Primary,Hard Ban
3rd,Beacon of Hope,Abjuration,1 Action,30 ft.,,"V, S",,1 Minute,,,,Buff,,"Choose any number of creatures within range. For the duration, each target has Advantage on Wisdom saving throws and Death Saving Throws and regains the maximum number of Hit Points possible from any healing.",https://www.dndbeyond.com/spells/2618911-beacon-of-hope,Conditions & Debuffs,Hard Ban,Primary,Hard Ban,Hard Ban,Secondary
3rd,Bestow Curse,Necromancy,1 Action,,,"V, S",,1 Minute,,,WIS Save,Debuff,,"You touch a creature, which must succeed on a Wisdom saving throw or become cursed for the duration. Until the curse ends, the target suffers one of the following effects of your choice:

Choose one ability. The target has Disadvantage on ability checks and saving throws made with that ability.

The target has Disadvantage on attack rolls against you.

In combat, the target must succeed on a Wisdom saving throw at the start of each of its turns or be forced to take the Dodge action on that turn.

If you deal damage to the target with an attack roll or a spell, the target takes an extra 1d8 Necrotic damage.

Using a Higher-Level Spell Slot. If you cast this spell using a level 4 spell slot, you can maintain Concentration on it for up to 10 minutes. If you use a level 5+ spell slot, the spell doesn’t require Concentration, and the duration becomes 8 hours (level 5–6 slot) or 24 hours (level 7–8 slot). If you use a level 9 spell slot, the spell lasts until dispelled.",https://www.dndbeyond.com/spells/2618923-bestow-curse,Curses & Hexes,Hard Ban,Primary,Hard Ban,Hard Ban,Hard Ban
3rd,Catnap,Enchantment,1 Action,30 ft.,,"S, M",,10 Minutes,,,,Buff (...),,"You make a calming gesture, and up to three willing creatures of your choice that you can see within range fall unconscious for the spell’s duration. The spell ends on a target early if it takes damage or someone uses an action to shake or slap it awake. If a target remains unconscious for the full duration, that target gains the benefit of a short rest, and it can’t be affected by this spell again until it finishes a long rest.

At Higher Levels. When you cast this spell using a spell slot of 4th level or higher, you can target one additional willing creature for each slot level above 3rd.",https://www.dndbeyond.com/spells/14754-catnap,Conditions & Debuffs,Hard Ban,Primary,Hard Ban,Hard Ban,Secondary
3rd,Crusader's Mantle,Evocation,1 Action,,(30 ft. ),V,,1 Minute,,,,Radiant,,"You radiate a magical aura in a 30-foot Emanation . While in the aura, you and your allies each deal an extra 1d4 Radiant damage when hitting with a weapon or an Unarmed Strike.",https://www.dndbeyond.com/spells/2619057-crusaders-mantle,Conditions & Debuffs,Hard Ban,Primary,Hard Ban,Hard Ban,Secondary
3rd,Feign Death,Necromancy,1 Action,,,"V, S, M",,1 Hour,,,,Blinded (...),,"You touch a willing creature and put it into a cataleptic state that is indistinguishable from death.

For the duration, the target appears dead to outward inspection and to spells used to determine the target’s status. The target has the Blinded and Incapacitated conditions, and its Speed is 0.

The target also has Resistance to all damage except Psychic damage, and it has Immunity to the Poisoned condition.",https://www.dndbeyond.com/spells/2618873-feign-death,Conditions & Debuffs,Hard Ban,Primary,Hard Ban,Hard Ban,Secondary
3rd,Gaseous Form,Transmutation,1 Action,,,"V, S, M",,1 Hour,,,,Buff (...),,"A willing creature you touch shape-shifts , along with everything it’s wearing and carrying, into a misty cloud for the duration. The spell ends on the target if it drops to 0 Hit Points or if it takes a Magic action to end the spell on itself.

While in this form, the target’s only method of movement is a Fly Speed of 10 feet, and it can hover. The target can enter and occupy the space of another creature. The target has Resistance to Bludgeoning, Piercing, and Slashing damage; it has Immunity to the Prone condition; and it has Advantage on Strength, Dexterity, and Constitution saving throws. The target can pass through narrow openings, but it treats liquids as though they were solid surfaces.

The target can’t talk or manipulate objects, and any objects it was carrying or holding can’t be dropped, used, or otherwise interacted with. Finally, the target can’t attack or cast spells.

Using a Higher-Level Spell Slot. You can target one additional creature for each spell slot level above 3.",https://www.dndbeyond.com/spells/2618927-gaseous-form,Conditions & Debuffs,Hard Ban,Primary,Hard Ban,Hard Ban,Secondary
3rd,Glyph of Warding,Abjuration,1 Hour,,,"V, S, M",,Until Dispelled or Triggered,,,DEX Save,Acid (...),,"You inscribe a glyph that later unleashes a magical effect. You inscribe it either on a surface (such as a table or a section of floor) or within an object that can be closed (such as a book or chest) to conceal the glyph. The glyph can cover an area no larger than 10 feet in diameter. If the surface or object is moved more than 10 feet from where you cast this spell, the glyph is broken, and the spell ends without being triggered.

The glyph is nearly imperceptible and requires a successful Wisdom ( Perception ) check against your spell save DC to notice.

When you inscribe the glyph, you set its trigger and choose whether it’s an explosive rune or a spell glyph, as explained below.

Set the Trigger. You decide what triggers the glyph when you cast the spell. For glyphs inscribed on a surface, common triggers include touching or stepping on the glyph, removing another object covering it, or approaching within a certain distance of it. For glyphs inscribed within an object, common triggers include opening that object or seeing the glyph. Once a glyph is triggered, this spell ends.

You can refine the trigger so that only creatures of certain types activate it (for example, the glyph could be set to affect Aberrations). You can also set conditions for creatures that don’t trigger the glyph, such as those who say a certain password.

Explosive Rune. When triggered, the glyph erupts with magical energy in a 20-foot-radius Sphere centered on the glyph. Each creature in the area makes a Dexterity saving throw. A creature takes 5d8 Acid, Cold, Fire, Lightning, or Thunder damage (your choice when you create the glyph) on a failed save or half as much damage on a successful one.

Spell Glyph. You can store a prepared spell of level 3 or lower in the glyph by casting it as part of creating the glyph. The spell must target a single creature or an area. The spell being stored has no immediate effect when cast in this way.

When the glyph is triggered, the stored spell takes effect. If the spell has a target, it targets the creature that triggered the glyph. If the spell affects an area, the area is centered on that creature. If the spell summons Hostile creatures or creates harmful objects or traps, they appear as close as possible to the intruder and attack it. If the spell requires Concentration , it lasts until the end of its full duration.

Using a Higher-Level Spell Slot. The damage of an explosive rune increases by 1d8 for each spell slot level above 3. If you create a spell glyph, you can store any spell of up to the same level as the spell slot you use for the Glyph of Warding .",https://www.dndbeyond.com/spells/2618951-glyph-of-warding,Wards & Sanctuaries,Hard Ban,Primary,Hard Ban,Hard Ban,Hard Ban
3rd,Intellect Fortress,Abjuration,1 Action,30 ft.,,V,,1 Hour,,,,Buff,,"For the duration, you or one willing creature you can see within range has resistance to psychic damage, as well as advantage on Intelligence, Wisdom, and Charisma saving throws.

At Higher Levels. When you cast this spell using a spell slot of 4th level or higher, you can target one additional creature for each slot level above 3rd. The creatures must be within 30 feet of each other when you target them.",https://www.dndbeyond.com/spells/718549-intellect-fortress,Conditions & Debuffs,Hard Ban,Primary,Hard Ban,Hard Ban,Secondary
3rd,Leomund's Tiny Hut,Evocation,1 Minute,,(10 ft. ),"V, S, M",,8 Hours,,,,Utility,,"A 10-foot Emanation springs into existence around you and remains stationary for the duration. The spell fails when you cast it if the Emanation isn’t big enough to fully encapsulate all creatures in its area.

Creatures and objects within the Emanation when you cast the spell can move through it freely. All other creatures and objects are barred from passing through it. Spells of level 3 or lower can’t be cast through it, and the effects of such spells can’t extend into it.

The atmosphere inside the Emanation is comfortable and dry, regardless of the weather outside. Until the spell ends, you can command the interior to have Dim Light or Darkness (no action required). The Emanation is opaque from the outside and of any color you choose, but it’s transparent from the inside.

The spell ends early if you leave the Emanation or if you cast it again.",https://www.dndbeyond.com/spells/2619013-leomunds-tiny-hut,Wards & Sanctuaries,Hard Ban,Primary,Hard Ban,Hard Ban,Hard Ban
3rd,Life Transference,Necromancy,1 Action,30 ft.,,"V, S",,Instantaneous,,,,Necrotic,,"You sacrifice some of your health to mend another creature’s injuries. You take 4d8 necrotic damage, which can’t be reduced in any way, and one creature of your choice that you can see within range regains a number of hit points equal to twice the necrotic damage you take.

At Higher Levels. When you cast this spell using a spell slot of 4th level or higher, the damage increases by 1d8 for each slot level above 3rd.",https://www.dndbeyond.com/spells/14880-life-transference,Healing & Restoration,Hard Ban,Primary,Hard Ban,Primary,Hard Ban
3rd,Magic Circle,Abjuration,1 Minute,10 ft.,(10 ft. *),"V, S, M",,1 Hour,,,CHA Save,,,"You create a 10-foot-radius, 20-foot-tall Cylinder of magical energy centered on a point on the ground that you can see within range. Glowing runes appear wherever the Cylinder intersects with the floor or other surface.

Choose one or more of the following types of creatures: Celestials, Elementals, Fey, Fiends, or Undead. The circle affects a creature of the chosen type in the following ways:

The creature can’t willingly enter the Cylinder by nonmagical means. If the creature tries to use teleportation or interplanar travel to do so, it must first succeed on a Charisma saving throw.

The creature has Disadvantage on attack rolls against targets within the Cylinder.

Targets within the Cylinder can’t be possessed by or gain the Charmed or Frightened condition from the creature.

Each time you cast this spell, you can cause its magic to operate in the reverse direction, preventing a creature of the specified type from leaving the Cylinder and protecting targets outside it.

Using a Higher-Level Spell Slot. The duration increases by 1 hour for each spell slot level above 3.",https://www.dndbeyond.com/spells/2619018-magic-circle,Wards & Sanctuaries,Hard Ban,Primary,Hard Ban,Hard Ban,Hard Ban
3rd,Mass Healing Word,Abjuration,1 Bonus Action,60 ft.,,V,,Instantaneous,,,,Healing,,"Up to six creatures of your choice that you can see within range regain Hit Points equal to 2d4 plus your spellcasting ability modifier.

Using a Higher-Level Spell Slot. The healing increases by 1d4 for each spell slot level above 3.",https://www.dndbeyond.com/spells/2619028-mass-healing-word,Healing & Restoration,Hard Ban,Primary,Hard Ban,Primary,Hard Ban
3rd,Nondetection,Abjuration,1 Action,,,"V, S, M",,8 Hours,,,,Deception,,"For the duration, you hide a target that you touch from Divination spells. The target can be a willing creature, or it can be a place or an object no larger than 10 feet in any dimension. The target can’t be targeted by any Divination spell or perceived through magical scrying sensors.",https://www.dndbeyond.com/spells/2619122-nondetection,Wards & Sanctuaries,Hard Ban,Primary,Hard Ban,Hard Ban,Hard Ban
3rd,Protection from Energy,Abjuration,1 Action,,,"V, S",,1 Hour,,,,Buff (...),,"For the duration, the willing creature you touch has Resistance to one damage type of your choice: Acid, Cold, Fire, Lightning, or Thunder.",https://www.dndbeyond.com/spells/2618908-protection-from-energy,Wards & Sanctuaries,Hard Ban,Primary,Hard Ban,Hard Ban,Hard Ban
3rd,Remove Curse,Abjuration,1 Action,,,"V, S",,Instantaneous,,,,Buff,,"At your touch, all curses affecting one creature or object end. If the object is a cursed magic item, its curse remains, but the spell breaks its owner’s Attunement to the object so it can be removed or discarded.",https://www.dndbeyond.com/spells/2618943-remove-curse,Healing & Restoration,Hard Ban,Primary,Hard Ban,Primary,Hard Ban
3rd,Revivify,Necromancy,1 Action,,,"V, S, M",,Instantaneous,,,,Healing,,"You touch a creature that has died within the last minute. That creature revives with 1 Hit Point. This spell can’t revive a creature that has died of old age, nor does it restore any missing body parts.",https://www.dndbeyond.com/spells/2618956-revivify,Resurrection,Hard Ban,Exclusive,Hard Ban,Hard Ban,Hard Ban
3rd,Sending,Divination,1 Action,,,"V, S, M",,Instantaneous,,,,Communication,,"You send a short message of 25 words or fewer to a creature you have met or a creature described to you by someone who has met it. The target hears the message in its mind, recognizes you as the sender if it knows you, and can answer in a like manner immediately. The spell enables targets to understand the meaning of your message.

You can send the message across any distance and even to other planes of existence, but if the target is on a different plane than you, there is a 5 percent chance that the message doesn’t arrive. You know if the delivery fails.

Upon receiving your message, a creature can block your ability to reach it again with this spell for 8 hours. If you try to send another message during that time, you learn that you are blocked, and the spell fails.",https://www.dndbeyond.com/spells/2619015-sending,Communication & Language,Hard Ban,Secondary,Hard Ban,Hard Ban,Exclusive
3rd,Slow,Transmutation,1 Action,120 ft.,(40 ft. ),"V, S, M",,1 Minute,,,WIS Save,Control (...),,"You alter time around up to six creatures of your choice in a 40-foot Cube within range. Each target must succeed on a Wisdom saving throw or be affected by this spell for the duration.

An affected target’s Speed is halved, it takes a −2 penalty to AC and Dexterity saving throws, and it can’t take Reactions. On its turns, it can take either an action or a Bonus Action, not both, and it can make only one attack if it takes the Attack action. If it casts a spell with a Somatic component, there is a 25 percent chance the spell fails as a result of the target making the spell’s gestures too slowly.

An affected target repeats the save at the end of each of its turns, ending the spell on itself on a success.",https://www.dndbeyond.com/spells/2619066-slow,Conditions & Debuffs,Hard Ban,Primary,Hard Ban,Hard Ban,Secondary
3rd,Speak with Dead,Necromancy,1 Action,10 ft.,,"V, S, M",,10 Minutes,,,,Communication (...),,"You grant the semblance of life to a corpse of your choice within range, allowing it to answer questions you pose. The corpse must have a mouth, and this spell fails if the deceased creature was Undead when it died. The spell also fails if the corpse was the target of this spell within the past 10 days.

Until the spell ends, you can ask the corpse up to five questions. The corpse knows only what it knew in life, including the languages it knew. Answers are usually brief, cryptic, or repetitive, and the corpse is under no compulsion to offer a truthful answer if you are antagonistic toward it or it recognizes you as an enemy. This spell doesn’t return the creature’s soul to its body, only its animating spirit. Thus, the corpse can’t learn new information, doesn’t comprehend anything that has happened since it died, and can’t speculate about future events.",https://www.dndbeyond.com/spells/2619068-speak-with-dead,Communication & Language,Hard Ban,Secondary,Hard Ban,Hard Ban,Exclusive
3rd,Spirit Guardians,Conjuration,1 Action,,(15 ft. ),"V, S, M",,10 Minutes,,,WIS Save,Radiant (...),,"Protective spirits flit around you in a 15-foot Emanation for the duration. If you are good or neutral, their spectral form appears angelic or fey (your choice). If you are evil, they appear fiendish.

When you cast this spell, you can designate creatures to be unaffected by it. Any other creature’s Speed is halved in the Emanation, and whenever the Emanation enters a creature’s space and whenever a creature enters the Emanation or ends its turn there, the creature must make a Wisdom saving throw. On a failed save, the creature takes 3d8 Radiant damage (if you are good or neutral) or 3d8 Necrotic damage (if you are evil). On a successful save, the creature takes half as much damage. A creature makes this save only once per turn.

Using a Higher-Level Spell Slot. The damage increases by 1d8 for each spell slot level above 3.",https://www.dndbeyond.com/spells/2619078-spirit-guardians,Summoning — Extraplanar,Hard Ban,Secondary,Hard Ban,Hard Ban,Hard Ban
3rd,Spirit Shroud,Necromancy,1 Bonus Action,,,"V, S",,1 Minute,,,,Cold (...),,"You call forth spirits of the dead, which flit around you for the spell’s duration. The spirits are intangible and invulnerable.

Until the spell ends, any attack you make deals 1d8 extra damage when you hit a creature within 10 feet of you. This damage is radiant, necrotic, or cold (your choice when you cast the spell). Any creature that takes this damage can’t regain hit points until the start of your next turn.

In addition, any creature of your choice that you can see that starts its turn within 10 feet of you has its speed reduced by 10 feet until the start of your next turn.

At Higher Levels. When you cast this spell using a spell slot of 4th level or higher, the damage increases by 1d8 for every two slot levels above 3rd.",https://www.dndbeyond.com/spells/718581-spirit-shroud,Curses & Hexes,Hard Ban,Primary,Hard Ban,Hard Ban,Hard Ban
3rd,Stinking Cloud,Conjuration,1 Action,90 ft.,(20 ft. ),"V, S, M",,1 Minute,,,CON Save,Poisoned,,"You create a 20-foot-radius Sphere of yellow, nauseating gas centered on a point within range. The cloud is Heavily Obscured . The cloud lingers in the air for the duration or until a strong wind (such as the one created by Gust of Wind ) disperses it.

Each creature that starts its turn in the Sphere must succeed on a Constitution saving throw or have the Poisoned condition until the end of the current turn. While Poisoned in this way, the creature can’t take an action or a Bonus Action.",https://www.dndbeyond.com/spells/2619091-stinking-cloud,Conditions & Debuffs,Hard Ban,Primary,Hard Ban,Hard Ban,Secondary
3rd,Summon Lesser Demons,Conjuration,1 Action,60 ft.,,"V, S, M",,1 Hour,,,,Summoning,,"You utter foul words, summoning demons from the chaos of the Abyss. Roll on the following table to determine what appears.

The DM chooses the demons, such as manes or dretches , and you choose the unoccupied spaces you can see within range where they appear. A summoned demon disappears when it drops to 0 hit points or when the spell ends.

The demons are hostile to all creatures, including you. Roll initiative for the summoned demons as a group, which has its own turns. The demons pursue and attack the nearest non-demons to the best of their ability.

As part of casting the spell, you can form a circle on the ground with the blood used as a material component. The circle is large enough to encompass your space. While the spell lasts, the summoned demons can’t cross the circle or harm it, and they can’t target anyone within it. Using the material component in this manner consumes it when the spell ends.

At Higher Levels. When you cast this spell using a spell slot of 6th or 7th level, you summon twice as many demons. If you cast it using a spell slot of 8th or 9th level, you summon three times as many demons.",https://www.dndbeyond.com/spells/14604-summon-lesser-demons,Summoning — Extraplanar,Hard Ban,Secondary,Hard Ban,Hard Ban,Hard Ban
3rd,Summon Shadowspawn,Conjuration,1 Action,90 ft.,,"V, S, M",,1 Hour,,,,Summoning,,"You call forth a shadowy spirit. It manifests in an unoccupied space that you can see within range. This corporeal form uses the Shadow Spirit stat block. When you cast the spell, choose an emotion: Fury, Despair, or Fear. The creature resembles a misshapen biped marked by the chosen emotion, which determines certain traits in its stat block. The creature disappears when it drops to 0 hit points or when the spell ends.

The creature is an ally to you and your companions. In combat, the creature shares your initiative count, but it takes its turn immediately after yours. It obeys your verbal commands (no action required by you). If you don’t issue any, it takes the Dodge action and uses its move to avoid danger.

At Higher Levels. When you cast this spell using a spell slot of 4th level or higher, use the higher level wherever the spell’s level appears in the stat block.

Shadow Spirit

Medium monstrosity

Armor Class 11 + the level of the spell (natural armor)

Hit Points 35 + 15 for each spell level above 3rd

Speed 40 ft.

Damage Resistances necrotic

Condition Immunities frightened

Senses darkvision 120 ft., passive Perception 10

Languages understands the languages you speak

Challenge — Proficiency Bonus equals your bonus

Terror Frenzy (Fury Only). The spirit has advantage on attack rolls against frightened creatures.

Weight of Sorrow (Despair Only). Any creature, other than you, that starts its turn within 5 feet of the spirit has its speed reduced by 20 feet until the start of that creature’s next turn.

Actions

Multiattack. The spirit makes a number of attacks equal to half this spell’s level (rounded down).

Chilling Rend. Melee Weapon Attack: your spell attack modifier to hit, reach 5 ft., one target. Hit: 1d12 + 3 + the spell’s level cold damage.

Dreadful Scream (1/Day). The spirit screams. Each creature within 30 feet of it must succeed on a Wisdom saving throw against your spell save DC or be frightened of the spirit for 1 minute. The frightened creature can repeat the saving throw at the end of each of its turns, ending the effect on itself on a success.

Bonus Actions

Shadow Stealth (Fear Only). While in dim light or darkness, the spirit takes the Hide action.",https://www.dndbeyond.com/spells/719948-summon-shadowspawn,Summoning — Extraplanar,Hard Ban,Secondary,Hard Ban,Hard Ban,Hard Ban
